"code","name","Artista","Musica","Letra"
3504,"03504.mp4","Lulu Santos","Adivinha O Quê","Ainda Lembro Aquela Noite Só Porque"
3505,"03505.mp4","Zé Ramalho","Admirável Gado Novo","Vocês Que Fazem Parte Dessa Massa"
3506,"03506.mp4","Fafá De Belém","Águas Passadas","Eu Sempre Disse A Mim Mesma Que Águas"
3507,"03507.mp4","Erva Doce","Amante Profissional","Moreno Alto, Bonito E Sensual"
3508,"03508.mp4","Lulu Santos","Aviso Aos Navegantes","Se Existe Alguém Na Ilha Se Tem Alguém"
3509,"03509.mp4","Rita Lee","Baila Comigo","Baila Comigo Como Se Baila Na Tribo"
3510,"03510.mp4","Chitãozinho E Xororó","Bailão De Peão","É Bailão,É Rodeio Festa De Peão Também"
3511,"03511.mp4","Barão Vermelho","Bete Balanço","Pode Seguir A Tua Estrela O Teu Brinquedo"
3512,"03512.mp4","Cravo E Canela","Coisa Boa Demais","Ai Que Coisa Boa, Coisa Boa Demais"
3513,"03513.mp4","Guilherme Arantes","Coisa Do Brasil","Foi Tão Bom Te Conhecer, Tão Fácil Te"
3514,"03514.mp4","Roupa Nova","Cristina","Sua Boca Na Minha, Seus Olhos Fechados"
3515,"03515.mp4","Roupa Nova","De Volta Pro Futuro","Sou O Mesmo Que Te Amou Não Me Diga"
3516,"03516.mp4","Grupo Tempero","Deixa Eu Te Querer","Bate Triste O Coração Sem Você Por Perto"
3517,"03517.mp4","Fagner","Deslizes","Não Sei Porque Insisto Tanto Em Te Querer"
3518,"03518.mp4","Kid Abelha","Deus (Apareça Na Televisão)","Ah Ah Ah Ah Ah Ah Ah Ah Se Ele É Deus"
3519,"03519.mp4","Leandro E Leonardo","Doce Mistério","Eu Não Sei De Onde Vem Esse Amor"
3520,"03520.mp4","Clara Nunes","É Baiana","É Baiana, Ê Ê Ê Baiana, Baianinha"
3521,"03521.mp4","Roberta Miranda","Eu Te Amo, Te Amo, Te Amo","Tanto Tempo Longe De Você"
3522,"03522.mp4","Leandro E Leonardo","Festa De Rodeio","Em Festa De Rodeio Não Dá Pra Ficar"
3523,"03523.mp4","Tiririca","Florentina","Essa Música Eu Tava Cantando Aí Na"
3524,"03524.mp4","Kid Abelha","Grand' Hotel","Se A Gente Não Tivesse Feito Tanta Coisa"
3525,"03525.mp4","Leci Brandão","Isso É Fundo De Quintal","O Que É Isso Meu Amor Venha Me Dizer"
3526,"03526.mp4","Paralamas Do Sucesso","Lanterna Dos Afogados","Quando Tá Escuro E Ninguém Te Ouve"
3527,"03527.mp4","Roupa Nova","Linda Demais","Linda Só Você Me Fascina Te Desejo"
3528,"03528.mp4","Tim Maia","Me Dê Motivo","É Engraçado Às Vezes A Gente Sente"
3529,"03529.mp4","Flor De Cheiro","Menino Lindo","Menino Lindo Eu Preciso Do Teu Beijo"
3530,"03530.mp4","Só Pra Contrariar","Nunca Mais Te Machucar","Dói Demais Saber Que Eu Errei E Não"
3531,"03531.mp4","Só Pra Contrariar","O Amor, Você E Eu","Se Olhar Nos Meus Olhos Verá O Que Tenho"
3532,"03532.mp4","Paralamas Do Sucesso","O Beco","No Beco Escuro Explode A Violência"
3533,"03533.mp4","Só Pra Contrariar","Outdoor","Já Coloquei Num Outdoor E Em Todos"
3534,"03534.mp4","Cidade Negra","Pensamento","Você Precisa Saber O Que Se Passa"
3535,"03535.mp4","Art Popular","Pimpolho","Pimpolho É Um Cara Bem Legal Pena Que"
3536,"03536.mp4","Clara Nunes","Portela Na Avenida","Portela Eu Nunca Vi Coisa Mais Bela"
3537,"03537.mp4","Raça Negra","Preciso Ter Alguém","De Novo A Solidão Bateu, Eu Vou Chorar"
3538,"03538.mp4","Simony","Quando Te Vi","Nem O Sol, Nem O Mar, Nem O Brilho"
3539,"03539.mp4","Zezé Di Camargo E Luciano","Sem Medo De Ser Feliz","Tira Essa Paixão Da Cabeça Tira Essa"
3540,"03540.mp4","Altemar Dutra","Sentimental Demais","Sentimental Eu Sou, Eu Sou Demais"
3541,"03541.mp4","Grupo Malícia","Sentinela","Na Janela Do Meu Quarto Uma Imagem"
3542,"03542.mp4","Katinguelê","Só Pedindo Bis","Não Vejo A Hora E O Momento De Te"
3543,"03543.mp4","Só Pra Contrariar","Te Amar Sem Medo","Tá Difícil Esquecer A Paixão Que"
3544,"03544.mp4","Art Popular","Temporal","Faz Tempo Que A Gente Não É Aquele"
3545,"03545.mp4","Negritude Júnior","Tic-Tac","Bate Forte O Tambor Eu Quero É Tique Tique"
3546,"03546.mp4","Só Pra Contrariar","Tributo Aos Mamonas","Apesar Do Pouco Tempo Que Eu Fico"
3547,"03547.mp4","Márcia Freire","Vermelho","A Cor Do Meu Batuque Tem O Toque"
3548,"03548.mp4","Chitãozinho E Xororó","Vez Em Quando Vem Me Ver","Não Toque Em Meus Cabelos Feito"
3549,"03549.mp4","Antonio Carlos E Jocafi","Você Abusou","Você Abusou Tirou Partido De Mim"
3550,"03550.mp4","Roupa Nova","Volta Pra Mim","Amanheci Sozinho Na Cama Num Vazio"
3551,"03551.mp4","Chitãozinho E Xororó","60 Dias Apaixonado","Viajando Pra Mato Grosso"
3552,"03552.mp4","Gera Samba","A Dança Da Cordinha","Passa Negão, Passa Loirinha"
3553,"03553.mp4","Roupa Nova","Amar É...","Amar...É Quando Não Dá Mais Pra"
3554,"03554.mp4","Marisa Monte","Balança Pema","Don Don Din Din Din Don Don Don Din"
3555,"03555.mp4","Elba Ramalho","Banho De Cheiro","Eu Quero Um Banho De Cheiro"
3556,"03556.mp4","Sérgio Reis","Cavalo Preto","Tenho Um Cavalo Preto Por Nome"
3557,"03557.mp4","Sérgio Reis","Chico Mineiro","Fizemos A Última Viagem"
3558,"03558.mp4","Zezé Di Camargo E Luciano","Como Um Anjo","Como Um Anjo Você Apareceu Na Minha Vida"
3559,"03559.mp4","Christian E Ralf","Desejo De Amar","Pele Macia, Toda Morena. Esse Seu Corpo"
3560,"03560.mp4","Martinho Da Vila","Devagar, Devagarinho","É Devagar, É Devagar"
3561,"03561.mp4","Cidade Negra","Doutor","Ó Doutor, Tem Que Me Ajudar"
3562,"03562.mp4","Cidade Negra","Downtown","Eu Fui Eu Fui Eu Fui Eu Fui Eu Fui"
3563,"03563.mp4","Akundum","Emaconhada","Kaya Erva Danada, Kaya Erva Danada"
3564,"03564.mp4","Chitãozinho E Xororó","Feito Eu","Caminhando Sem Saber Pra Onde"
3565,"03565.mp4","Carrapicho","Festa De Um Povo","Ôh, Ôh,Ôh É, Ôh, Lê,Lê, Lê, Lê"
3566,"03566.mp4","Zezé Di Camargo E Luciano","Foi A Primeira Vez","Foi A Primeira Vez A Mais Forte Talvez"
3567,"03567.mp4","Exaltasamba","Gamei","Quando Eu Vi, Me Amarrei"
3568,"03568.mp4","Zezé Di Camargo E Luciano","Indiferença","Fala Pra Mim, Diz A Verdade"
3569,"03569.mp4","Legião Urbana","Índios","Quem Me Dera Ao Menos De Uma Vez"
3570,"03570.mp4","Biro Do Cavaco","Jéssica","Sem A Gente Esperar Nasce .."
3571,"03571.mp4","Paralamas Do Sucesso","La Bella Luna","Por Mais Que Eu Pense"
3572,"03572.mp4","Laura Pausini","La Solitudine","Marco Se N' È Andato E Non Ritorna"
3573,"03573.mp4","Chitãozinho E Xororó","Loira Gelada","Hoje Eu Vou Cair No Mundo"
3574,"03574.mp4","Rick Martin","Maria","Un, Dos, Tres"
3575,"03575.mp4","Xuxa","Marquei Um X","Marquei Um X Um X"
3576,"03576.mp4","Companhia Do Pagode","Melô Do Strip Tease","Eu Lhe Disse Que Não Bulisse"
3577,"03577.mp4","Netinho","Menina Linda","Oh Menina Linda Tão Bela"
3578,"03578.mp4","Gal Costa","Meu Bem, Meu Mal","Você É Meu Caminho, Meu Vinho"
3579,"03579.mp4","Royce Do Cavaco","Meu Coração É Teu","Infelizmente Nós Somos Assim"
3580,"03580.mp4","Roberto Carlos","Mulher De 40","Sorriso Bonito Olhar De Quem Sabe"
3581,"03581.mp4","Zezé Di Camargo E Luciano","Na Hora H","Eu Preciso Te Dizer Que Ainda"
3582,"03582.mp4","Art Popular","Nani","Quantas Vezes Nani Tantas Vezes Nani"
3583,"03583.mp4","Daniela Mercury","Nobre Vagabundo","Quanto Tempo Tenho Pra Matar Essa"
3584,"03584.mp4","Milton Nascimento","Nos Bailes Da Vida","Foi Nos Bailes Da Vida Ou Num Bar"
3585,"03585.mp4","Zélia Duncan","Nos Lençóis Desse Reggae","Flash De Viagem"
3586,"03586.mp4","Ara Ketu","Nossa Guerra Santa","Esse Nosso Amor É Uma Loucura"
3587,"03587.mp4","Gal Costa E Gilberto Gil","Odara","Deixa Eu Dançar"
3588,"03588.mp4","Chitãozinho E Xororó","Página De Amigos","Ela Ligou Terminando, Tudo Entre Eu E Ela..."
3589,"03589.mp4","Sérgio Reis","Panela Velha","Tô De Namoro Com Uma Moça Solteirona"
3590,"03590.mp4","Zezé Di Camargo E Luciano","Por Amor Te Deixo Ir","Pode Ir, Não Impeço Sua Viagem"
3591,"03591.mp4","Zezé Di Camargo E Luciano","Preciso Ser Amado","Não Preciso De Amor Eu Preciso É Ser Amado"
3592,"03592.mp4","Grupo Raça","Pura Emoção","É Frio Sem Você, Meu Amor"
3593,"03593.mp4","Sérgio Reis","Saudade Da Minha Terra","De Que Me Adianta Viver Na Cidade"
3594,"03594.mp4","Sandra De Sá","Sozinha","Às Vezes No Silêncio Da Noite"
3595,"03595.mp4","Skank","Tão Seu","Sinto Sua Falta"
3596,"03596.mp4","Legião Urbana","Teatro De Vampiros","Sempre Precisei De Um Pouco De Atenção"
3597,"03597.mp4","Roberto Carlos","Tem Coisas Que A Gente Não Tira","Que Bom Te Encontrar"
3598,"03598.mp4","Art Popular","Trapaça","Quando Você Passa Tento Te Dizer"
3599,"03599.mp4","Banda Cheiro De Amor","Vai Sacudir, Vai Abalar","Vai Sacudir Vai Abalar"
3600,"03600.mp4","Gilberto Gil","Vamos Fugir","Vamos Fugir"
3601,"03601.mp4","Carlinhos Brown","A Namorada","Ei Bicho O Broto Do Seu Lado"
3602,"03602.mp4","Paralamas Do Sucesso","A Novidade","A Novidade Veio Dar À Praia"
3603,"03603.mp4","Legião Urbana","A Via Láctea","Quando Tudo Está Perdido"
3604,"03604.mp4","Só Pra Contrariar","Amor Verdadeiro","Olhe Dentro De Mim, Você Pode Se Ver"
3605,"03605.mp4","Virgulóides","Bagulho No Bumba","Nesse Bumba Eu Não Ando Mais"
3606,"03606.mp4","Marisa Monte","Beija Eu","Seja Eu, Seja Eu Deixa Que Eu Seja Eu"
3607,"03607.mp4","Banda Eva","Beleza Rara","Eu Não Posso Deixar Que O Tempo"
3608,"03608.mp4","Cidade Negra","Casa","É Seu Único Lugar No Mundo"
3609,"03609.mp4","Elba Ramalho","Chão De Giz","Desço Dessa Solidão"
3610,"03610.mp4","Rita Lee","Coisas Da Vida","Quando A Lua Apareceu"
3611,"03611.mp4","Elis Regina","Como Nossos Pais","Não Quero Lhe Falar Meu Grande Amor"
3612,"03612.mp4","Marisa Monte","Dança Da Solidão","Solidão É Lava Que Cobre Tudo"
3613,"03613.mp4","Lulu Santos","Dancin' Days","Abra Suas Asas Solte Suas Feras"
3614,"03614.mp4","Legião Urbana","Dezesseis","João Roberto Era O Maioral"
3615,"03615.mp4","Leandro E Leonardo","Diz Pra Mim","Diz Pra Mim"
3616,"03616.mp4","Fábio Júnior","Entrega","Você Foi Chegando De Mansinho"
3617,"03617.mp4","Marisa Monte","Esta Melodia","Quando Vem Rompendo O Dia"
3618,"03618.mp4","Skank","Eu Disse A Ela","Quando Eu Disse A Ela Que O Amor Passou"
3619,"03619.mp4","Cidade Negra","Firmamento","O Que É Que Eu Vou Fazer Agora"
3620,"03620.mp4","Lulu Santos","Graal","É Necessário Descobrir"
3621,"03621.mp4","Exaltasamba","Louca Paixão","Vem A Noite E Eu Tão Só Doidinho Pra Te"
3622,"03622.mp4","Exaltasamba","Luz Do Desejo","Apague A Luz, Deita Ao Meu Lado"
3623,"03623.mp4","Cássia Eller","Malandragem","Quem Sabe Eu Ainda Sou Uma Garotinha"
3624,"03624.mp4","Chico César","Mama África","Let Me Sing Let Me Sing"
3625,"03625.mp4","Grupo Cafuné","Melô Do Pirulito","Olha O Piu Ôh... Pirulito"
3626,"03626.mp4","Netinho","Milla","Oh Milla Mil E Uma Noites De Amor"
3627,"03627.mp4","Cidade Negra","Mucama","Ô Ô Ô O Que Se Espera De Uma Nação"
3628,"03628.mp4","Maurício Mattar","Muito Romântico","Eu Tenho Andado Tão Calado"
3629,"03629.mp4","Marisa Monte","Na Estrada","Tchu Ru Ru Ru Ru Ru Tchu Tchu Tchu"
3630,"03630.mp4","Roupa Nova","Nossa História","Hoje Eu Venho Outra Vez Meu Lugar"
3631,"03631.mp4","Skank","O Homem Que Sabia Demais","Sabia?"
3632,"03632.mp4","Sérgio Reis","O Menino Da Porteira","Toda Vez Que Eu Viajava"
3633,"03633.mp4","Leandro E Leonardo","Por Causa Dela","Por Causa Dela Eu Perdi O Rumo"
3634,"03634.mp4","Raça Negra","Preciso Desse Amor","À Noite No Meu Quarto, Solidão"
3635,"03635.mp4","Daniela Mercury","Rapunzel","Love As Suas Tranças De Mel"
3636,"03636.mp4","Maurício Mattar","Rumos Do Coração","Ah! Se Eu Pudesse Ao Menos Sair De Mim"
3637,"03637.mp4","Molejo","Samba Diferente","Quem Samba Com Molejo Samba"
3638,"03638.mp4","Royce Do Cavaco","Só Você","Quando A Luz Se Apaga"
3639,"03639.mp4","Renato Russo","Strani Amori","Mi Dispiace Devo Andare Via"
3640,"03640.mp4","Negritude Júnior","Tanajura","Tana...Tanajura Jura Que Me Ama"
3641,"03641.mp4","Exaltasamba","Telegrama","Ah! Que Saudades De Você Estou"
3642,"03642.mp4","Lulu Santos","Tudo Igual","Então É Assim Que A Vida Faz"
3643,"03643.mp4","Legião Urbana","Vento No Litoral","De Tarde Quero Descansar Chegar"
3644,"03644.mp4","Zeca Pagodinho","Verdade","Descobri Que Te Amo Demais"
3645,"03645.mp4","Christian E Ralf","Vira Virou","Por Causa De Você"
3646,"03646.mp4","Lobão","A Queda","Quantos Sonhos E Sonhos Acordo"
3647,"03647.mp4","Legião Urbana","Angra Dos Reis","Deixa, Se Fosse Sempre Assim"
3648,"03648.mp4","Exaltasamba","Armadilha","Dessa Vez Te Peguei De Jeito"
3649,"03649.mp4","Tim Maia","Azul Da Cor Do Mar","Ah, Se O Mundo Inteiro Me Pudesse Ouvir"
3650,"03650.mp4","Beto Barbosa","Balança O Bumbum Muchacha","Quando Eu Te Vejo Bate Meu Coração"
3651,"03651.mp4","Sérgio Murilo","Broto Legal","Oh,Oh Que Broto Legal Garota Fenomenal"
3652,"03652.mp4","Raul Seixas","Capim Guiné","Plantei Um Sítio No Sertão De Piritiba"
3653,"03653.mp4","Toquinho E Vinícius De Moraes","Carta Ao Tom 74","Rua Nascimento Silva Cento E Vinte"
3654,"03654.mp4","Kid Abelha","Como É Que Eu Vou Embora","Ah,Ah,Ah,Ah,Ah,Ah,Ah"
3655,"03655.mp4","Chitãozinho E Xororó","Confidências","Abra Os Olhos Do Seu Coração"
3656,"03656.mp4","Claudinho E Buchecha","Conquista","Sabe Tchu Ru Ru"
3657,"03657.mp4","Banda Cheiro De Amor","É Demais Meu Rei","Vou Dar A Volta Pelo Globo Terrestre"
3658,"03658.mp4","Skank","É Proibido Fumar","É Proibido Fumar Diz O Aviso Que Eu Li"
3659,"03659.mp4","Skank","É Uma Partida De Futebol","Ô Bola Na Trave Não Altera O Placar"
3660,"03660.mp4","Exaltasamba","É Você","É Você"
3661,"03661.mp4","Cássia Eller","E.C.T.","Tava Com Cara Que Carimba Postais"
3662,"03662.mp4","Shakira","Estoy Aqui","Ya Sé Que No Vedrás Todo Lo Que Fue"
3663,"03663.mp4","Leandro E Leonardo","Eu Sou Desejo, Você É Paixão","Você Me Amou E Eu Te Amei"
3664,"03664.mp4","Cidade Negra","Falar A Verdade","Vamos Falar A Verdade Pra Vocês"
3665,"03665.mp4","Nino Rosso","Io Che Non Vivo Senza Te","Siamo Qui Noi Soli Como Ogni Sera"
3666,"03666.mp4","Tim Maia","Leva","Foi Bom Eu Ficar Com Você O Ano Inteiro"
3667,"03667.mp4","Paralamas Do Sucesso","Lourinha Bombril","Para E Repara, Olha Como Ela Samba"
3668,"03668.mp4","Caetano Veloso","Lua De São Jorge","Lua De São Jorge, Lua Deslumbrante"
3669,"03669.mp4","Katinguelê","Luana","Eu Vendo Você Na Tristeza"
3670,"03670.mp4","Cidade Negra","Luta De Classes","Tudo O Que Eu Posso Ver"
3671,"03671.mp4","Marina Lima","Mesmo Que Seja Eu","Sei Que Você Fez Os Seus Castelos"
3672,"03672.mp4","Cidade Negra","Minha Irmã","Ô, Isso É Que Me Faz Sorrir"
3673,"03673.mp4","Gian E Giovani","Não Vivo Sem Você","Todo Dia É A Mesma Coisa"
3674,"03674.mp4","Rita Lee","Nem Luxo Nem Lixo","Como Vai Você? Assim Como Eu"
3675,"03675.mp4","Free Bongusto","O Sole Mio","Che Bella Cosa 'Na Iurna Ta'E Sole"
3676,"03676.mp4","Mastruz Com Leite","Olha Pro Céu","Olha Pro Céu Meu Amor Vê"
3677,"03677.mp4","Chitãozinho E Xororó","Palavras (Words)","Smile, An Everlasting Smile"
3678,"03678.mp4","Chitãozinho E Xororó","Pode Ser Pra Valer","Se Você Está Aí Sozinha"
3679,"03679.mp4","Titãs","Polícia","Dizem Que Ela Existe Pra Ajudar"
3680,"03680.mp4","Tim Maia","Primavera","Quando O Inverno Chegar"
3681,"03681.mp4","Peppino Di Capri","Roberta","Lo Sai Non É Vero Che Non Ti Voglio Piú"
3682,"03682.mp4","Gino Paoli","Sapore Di Sale","Sapore Di Sale Sapore Di Mare"
3683,"03683.mp4","João Mineiro E Marciano","Seu Amor Ainda É Tudo","Muito Prazer Em Revê-La"
3684,"03684.mp4","Exaltasamba","Sincera","Mais Que Amiga Foi Um Xodó"
3685,"03685.mp4","Chitãozinho E Xororó","Só Quem Amou Demais","Se Já Doeu Demais A Falta Desse Amor"
3686,"03686.mp4","Kid Abelha","Te Amo Pra Sempre","Na Na Na Na Na Na Na"
3687,"03687.mp4","Raul Seixas","Trem Das 7","Ói, Ói O Trem"
3688,"03688.mp4","Paralamas Do Sucesso","Você","Você É Algo Assim É Tudo Pra Mim"
3689,"03689.mp4","Mastruz Com Leite","Vou Te Matar De Cheiro","Tô Doidinha Pra Me Deitar Naquela Cama"
3690,"03690.mp4","Bobby Solo","Zíngara","Prendi Questa Mano Zíngara"
3691,"03691.mp4","É O Tchan","A Lourinha","Sei Que A Lourinha Geladinha"
3692,"03692.mp4","Fafá De Belém","Abandonada","Abandonada Por Você"
3693,"03693.mp4","Negritude Júnior","Absoluta","Não Seja Deselegante Tentando Dar"
3694,"03694.mp4","Pirilampo E Saracura","Boiadeiro Errante","Eu Venho Vindo De Uma Querência"
3695,"03695.mp4","Yahoo","Caminhos Do Sol","Sem Você A Vida Pode Parecer"
3696,"03696.mp4","Fagner","Canteiros","Quando Penso Em Você"
3697,"03697.mp4","Nélson Gonçalves","Carinhoso","Meu Coração Não Sei Por Que"
3698,"03698.mp4","Benito De Paula","Charlie Brown","Eh, Meu Amigo Charlie"
3699,"03699.mp4","Kid Abelha","Como Eu Quero","Diz Prá Eu Ficar Muda Faz Cara De Mistério"
3700,"03700.mp4","Roberto Carlos","Como Vai Você","Como Vai Você Eu Preciso Saber Da Sua Vida"
3701,"03701.mp4","Rita Pavone","Datemi Un Martelo (Remix)","Datemi Um Martelo Che Cosa Ne Vuoi Fare?"
3702,"03702.mp4","É O Tchan","Dengo De Mulheres","Toda Moça Tem Um Dengo"
3703,"03703.mp4","Jerry Adriani","Diana","Não Te Esqueças Meu Amor"
3704,"03704.mp4","Chitãozinho E Xororó","É Assim Que Te Amo","Sem Me Pedir Você Chegou Assim"
3705,"03705.mp4","Leandro E Leonardo","É Por Você Que Canto","Quanto Mais O Tempo Passa"
3706,"03706.mp4","Chitãozinho E Xororó","Ela Não Vai Mais Chorar","Por Tantas Vezes Eu Menti"
3707,"03707.mp4","Erasmo Carlos","Festa De Arromba","Vejam Só Que Festa De Arromba"
3708,"03708.mp4","Fábio Júnior","Impossível Acreditar Que Perdi","Não, Eu Não Consigo Acreditar"
3709,"03709.mp4","Mara Maravilha","Jesus Cristo","Jesus Cristo, Jesus Cristo"
3710,"03710.mp4","Grupo União","Jura De Amor","Você Veio De Repente E Reacendeu"
3711,"03711.mp4","É O Tchan","Malhação","Vou Lhe Dizer É Bom Malhar"
3712,"03712.mp4","Os Magníficos","Me Usa","Momentos De Amor Quero Com Você"
3713,"03713.mp4","Yahoo","Mordida De Amor","Quando Faz Amor Se Olha No Espelho"
3714,"03714.mp4","Asa De Águia","Não Tem Lua","Não Tem Lua Que Faça Você Me Amar"
3715,"03715.mp4","Razão Brasileira","Naturalmente","Entre Nós Dois Talvez Possa Acontecer"
3716,"03716.mp4","Leandro E Leonardo","Pimba","Pode Crer Rapaziada Tudo Em Nome"
3717,"03717.mp4","Companhia Do Pagode","Pingos De Lágrima","Pingos De Lágrima Molharam O Meu Rosto"
3718,"03718.mp4","Moraes Moreira","Pombo-Correio","Pombo-Correio Voa Depressa"
3719,"03719.mp4","Diana","Porque Brigamos","Quanto Mais Eu Penso Em Lhe Deixar"
3720,"03720.mp4","Grupo Malícia","Primeiro Beijo","Pára De Tanta Bobagem Só Pra Me"
3721,"03721.mp4","Jorge Benjor","Que Maravilha","Lá Fora Está Chovendo"
3722,"03722.mp4","Jorge Benjor","Que Pena","Ela Já Não Gosta Mais De Mim"
3723,"03723.mp4","Caetano Veloso","Queixa","Um Amor Assim Delicado"
3724,"03724.mp4","Gilberto Gil","Se Eu Quiser Falar Com Deus","Se Eu Quiser Falar Com Deus"
3725,"03725.mp4","Laura Pausini","Se Fué","Ya No Responde Ni Al Teléfono"
3726,"03726.mp4","Adalberto E Adriano","Separação","Qual Terá Sido O Motivo Da Nossa"
3727,"03727.mp4","Selma Reis","Sombra Em Nosso Olhar","Sei, Só Não Sei Porque Penso Em Você"
3728,"03728.mp4","Lulu Santos","Tão Bem","Ela Me Encontrou Eu Tava Por Aí"
3729,"03729.mp4","Elis Regina","Tiro Ao Álvaro","De Tanto Levar Frechada Do Teu Olhar"
3730,"03730.mp4","Lulu Santos","Toda Forma De Amor","Eu Não Pedi Pra Nascer"
3731,"03731.mp4","Cazuza","Todo Amor Que Houver Nesta Vida","Eu Quero A Sorte De Um Amor Tranqüilo"
3732,"03732.mp4","Banda Cheiro De Amor","Todo Mundo Dança","Todo Mundo Dança Move Corpo"
3733,"03733.mp4","Emílio Santiago","Tudo Que Se Quer - Com Verônica Sabino","Olha Nos Meus Olhos Esquece..."
3734,"03734.mp4","Paulo Sérgio","Última Canção","Esta É A Última Canção Que Eu Faço"
3735,"03735.mp4","Paulo Diniz","Um Chopp Pra Distrair","Ela Passou, Deixando Um Sorriso No Chão"
3736,"03736.mp4","Leno E Lilian","A Pobreza","Todo Mundo Tem Um Amor Na Vida"
3737,"03737.mp4","Agnaldo Rayol","A Praia","Em Plena Praia No Céu Azul Brilhava O Sol"
3738,"03738.mp4","João Mineiro E Marciano","Aline","Ontem Retornei Na Areia"
3739,"03739.mp4","Agnaldo Rayol","Amigos Para Sempre","Eu Não Tenho Nada Pra Dizer"
3740,"03740.mp4","Katinguelê","Apelo De Quem Ama","Quando Eu Me Encontrar"
3741,"03741.mp4","Caetano Veloso","Beleza Pura","Não Me Amarra Dinheiro Não"
3742,"03742.mp4","Luiz Ayrão","Bola Dividida","Será Que Essa Gente Percebeu"
3743,"03743.mp4","Roberto Leal","Casa Portuguesa","Numa Casa Portuguesa Fica Bem"
3744,"03744.mp4","Simony","Certas Coisas","Não Existiria Som"
3745,"03745.mp4","Tom Jobim","Chega De Saudade","Vai, Minha Tristeza E Diz A Ela Que"
3746,"03746.mp4","Sílvio Brito","Cidadão","Tá Vendo Aquele Edifício Moço?"
3747,"03747.mp4","Katinguelê","Cilada","Eh, Mulher Me Comovi Com Sua História"
3748,"03748.mp4","Karametade","Decisão","Há Tanto Tempo Queria Te Falar"
3749,"03749.mp4","Só Pra Contrariar","Depois Do Prazer","Tô Fazendo Amor Com Outra Pessoa"
3750,"03750.mp4","Shakira","Dónde Estás Corazón","Dónde Estás Corazón?"
3751,"03751.mp4","Roberto Carlos","Eu Preciso De Você","Eu Preciso De Você"
3752,"03752.mp4","Marina Lima","Eu Te Amo Você","Acho Que Não Sei Não, Eu Não Queria"
3753,"03753.mp4","Kid Abelha","Fixação","Seu Rosto Na Tv Parece Um Milagre"
3754,"03754.mp4","João Paulo E Daniel","Hoje Eu Sei","Outra Vez Eu Cheguei Tarde"
3755,"03755.mp4","14 Bis","Linda Juventude","Zabelê, Zumbi, Besouro Vespa Fabricando"
3756,"03756.mp4","Gilberto Gil","Maracatu Atômico","Atrás Do Arranha-Céu Tem O Céu"
3757,"03757.mp4","Milton Nascimento","Maria Maria","Maria, Maria É Um Dom"
3758,"03758.mp4","Jorge Benjor","Mas Que Nada","O Aria Raiô Obá Obá Obá"
3759,"03759.mp4","É O Tchan","Melô Do Tchaco Ii","Frente Do Tchaco Pro Lado E Pra Trás"
3760,"03760.mp4","Raul Seixas","Metamorfose Ambulante","Eu Prefiro Ser Essa Metamorfose"
3761,"03761.mp4","Clara Nunes","O Mar Serenou","O Mar Serenou Quando Ela Pisou"
3762,"03762.mp4","Negritude Júnior","Olhos Vermelhos","As Coisas Já Não Andam Bem Pra Mim"
3763,"03763.mp4","Cavalo De Pau","Padecer No Paraíso","Eu Vivi Todo Esse Tempo Só Pra Você"
3764,"03764.mp4","Chitãozinho E Xororó","Pé Na Estrada","Pé Na Estrada, Lá Vamos Nós Outra Vez"
3765,"03765.mp4","Paulo Diniz","Pingos De Amor","A Vida Passa"
3766,"03766.mp4","Negritude Júnior","Que Dure Para Sempre","Você Está Aí Sozinha"
3767,"03767.mp4","É O Tchan","Ralando O Tchan","Essa É A Mistura Do Brasil Com O Egito"
3768,"03768.mp4","Zezé Di Camargo E Luciano","Rédeas Do Possante","Cada Palmo Dessa Estrada"
3769,"03769.mp4","Paralamas Do Sucesso","Romance Ideal","Ela É Só Uma Menina E Eu Pagando"
3770,"03770.mp4","João Paulo E Daniel","Rosto Molhado","Enxugue O Rosto Meu Amor"
3771,"03771.mp4","Elza Soares","Samba Da Minha Terra","O Samba Da Minha Terra Deixa"
3772,"03772.mp4","Milton Carlos","Samba Quadrado","Eu Fiz Um Samba Quadrado"
3773,"03773.mp4","Zezé Di Camargo E Luciano","Saudade Dos Beatles","Às Vezes Volto No Tempo"
3774,"03774.mp4","Titãs","Sonífera Ilha","Não Posso Mais Viver Assim"
3775,"03775.mp4","Ara Ketu","Tentação","No Meu Corpo Ficou A Lembrança"
3776,"03776.mp4","Débora Blando","Unicamente","Vem Sentir A Era Das Águas"
3777,"03777.mp4","Benito De Paula","Vai Ficar Na Saudade","Você Cortou O Barato Do Meu Amor"
3778,"03778.mp4","Marcos Valle","Viola Enluarada - Com Milton Nascimento","A Mão Que Toca Um Violão..."
3779,"03779.mp4","João Paulo E Daniel","Você Só Me Faz Feliz","É Nesse Sonho Que Eu Me Encontro"
3780,"03780.mp4","Maria Bethânia","Volta Por Cima","Chorei, Não Procurei Esconder"
3781,"03781.mp4","Companhia Do Pagode","A Dança Do Robô","Essa É A Nova Dança Que Nós"
3782,"03782.mp4","Carnaval","Allah La Óh","Allahh Lá Oh,Oh,Oh,Oh,Oh,Oh,Oh"
3783,"03783.mp4","Carnaval","Aurora","Se Você Fosse Sincera Ô,Ô,Ô,Ô"
3784,"03784.mp4","Carnaval","Cabeleira Do Zezé","Olha A Cabeleira Do Zezé"
3785,"03785.mp4","Carnaval","Cachaça","Você Pensa Que Cachaça É Água"
3786,"03786.mp4","Leandro E Leonardo","Cerveja","Hoje É Sexta - Feira Chega De Canseira"
3787,"03787.mp4","Carnaval","Coração De Jacaré","Trocaram O Coração Da Minha Sogra"
3788,"03788.mp4","Exaltasamba","Dez A Um","Quantas Vezes Dormi Com O Astro Rei"
3789,"03789.mp4","Adryana Ribeiro","E Agora","E Agora Como É Que Eu Vou Ficar"
3790,"03790.mp4","João Paulo E Daniel","Ela Tem O Dom De Me Fazer Chorar","Deus, Hoje Eu Vim Aqui"
3791,"03791.mp4","Katinguelê","Engraçadinha","Linda De Viver"
3792,"03792.mp4","Gilberto Gil","Estrela","Há De Surgir Uma Estrela No Céu"
3793,"03793.mp4","João Paulo E Daniel","Eu Me Amarrei","Eu Me Amarrei, Eu Me Amarrei"
3794,"03794.mp4","Netinho","Fim De Semana","Fim De Semana É Sexta - Feira"
3795,"03795.mp4","Jorge Benjor","Fio Maravilha","Novamente Ele Chegou Com"
3796,"03796.mp4","Amelinha","Frevo Mulher","Quantos Aqui Ouvem, Os Olhos"
3797,"03797.mp4","Art Popular","Fricote","Você É Meu Amor Te Quero De Novo"
3798,"03798.mp4","Leandro E Leonardo","Horizonte Azul","O Que Mais Me Dói Em Noites Sem"
3799,"03799.mp4","Laura Pausini","Inesquecível (Incancellabile)","Às Vezes Me Pergunto Se Eu Viverei"
3800,"03800.mp4","Carnaval","Jardineira","Ó Jardineira Por Que Estás Tão Triste"
3801,"03801.mp4","Moraes Moreira","Lá Vem O Brasil Descendo A Ladeir","Aquem Desce Do Morro Não Morre"
3802,"03802.mp4","Carnaval","Mamãe Eu Quero","Mamãe Eu Quero, Mamãe Eu Quero"
3803,"03803.mp4","Carnaval","Marcha Da Cueca","Eu Mato, Eu Mato"
3804,"03804.mp4","Carnaval","Maria Sapatão","Maria Sapatão, Sapatão, Sapatão"
3805,"03805.mp4","Carnaval","Me Dá Um Dinheiro Aí","Ei, Você Aí"
3806,"03806.mp4","Só Pra Contrariar","Mineirinho","Eu Não Tenho Culpa De"
3807,"03807.mp4","Carnaval","O Teu Cabelo Não Nega","O Teu Cabelo Não Nega Mulata"
3808,"03808.mp4","Toke Divinal","Pequena Princesa","Pequena Princesa És A Primavera"
3809,"03809.mp4","Titãs","Pra Dizer Adeus","Você Apareceu Do Nada"
3810,"03810.mp4","Carnaval","Quem Sabe, Sabe","Quem Sabe Sabe, Conhece Bem"
3811,"03811.mp4","Chiquititas","Remexe (Rechufas)","Tudo Se Transforma Com Magia"
