"code","name","Artista","Musica","Letra"
9560,"09560.mp4","Belo","Vem","Você Estava Ali Parada Tão Sozinha"
9561,"09561.mp4","Víctor E Léo","Vida Boa","Moro Num Lugar"
9562,"09562.mp4","Ney Matogrosso","Vira-Lata De Raça","Eu Sou Só Um Bicho Carente De Carinho"
9563,"09563.mp4","Rádio Táxi","Vivendo Ilusão","Quero Estar Contigo Vivendo Ilusão"
9564,"09564.mp4","Kelly Key","Você É O Cara","A Confiança Tá Fluindo"
9565,"09565.mp4","Natália Siqueira","Você Me Ensinou O Amor","Era Tão Perfeito Era Como Um Sonho B"
9566,"09566.mp4","Paula Toller","Você Me Ganhou De Presente","Você Me Ganhou De Presente"
9567,"09567.mp4","Tchê Barbaridade","Você Não Vale Nada","Você Não Vale Nada Mas Eu Gosto De Vo"
9568,"09568.mp4","Belo","Você Sabe","Você Sabe Que Nasceu Pra Mim"
9569,"09569.mp4","Alexandre Peixe","Você Vai Pirar","Você Vai Pirar Vai Enlouquecer"
9570,"09570.mp4","Paulinho Moska","Vontade","Todo Mundo Tem Alguma Vontade"
9571,"09571.mp4","Exaltasamba","40 Graus De Amor","Meu Coração É O Teu Lugar"
9572,"09572.mp4","Luka E Papas Da Língua","A Aposta","Eu Jogo Tudo Ele Pega E Joga Fora"
9573,"09573.mp4","Os Serranos","A Chapa Vai Esquentar","Hoje A Chapa Vai Esquentar"
9574,"09574.mp4","A Zorra","A Cor Da Esperança","Sei"
9575,"09575.mp4","Alexandre Pires","A Deus Eu Peço","Que A Menina Dos Meus Olhos"
9576,"09576.mp4","Leonardo","A Fila Anda","Tá Se Achando Demais Tá Pisando Sem D"
9577,"09577.mp4","Chiclete Com Banana","A Fila Andou","Nananá Nana Nananá Nananá Nana Nana"
9578,"09578.mp4","Pedindo Bis","A Gente Bota Pra Quebrar","Hoje Você Não Se Zanga Quando Eu Vou"
9579,"09579.mp4","Nando Reis","A Letra A","A Letra A Do Seu Nome"
9580,"09580.mp4","Kelly Key","A Loirinha, O Playboy E O Negão","Geral Tava Olhando A Loirinha Com O"
9581,"09581.mp4","Netinho","A Menina Das Meninas","A Menina Das Meninas Vem Na Contramão"
9582,"09582.mp4","Os Magníficos","A Preferida Do Brasil","Ah... Até Que Enfim Que Bom Você Apar"
9583,"09583.mp4","Sorriso Maroto","A Primeira Namorada","Eu Não Sei Se Vale A Pena"
9584,"09584.mp4","Gino E Geno","A Saudade Tá Pegando","A Saudade Tá Pegando"
9585,"09585.mp4","Luiz Melodia","A Voz Do Morro","Eu Sou O Samba"
9586,"09586.mp4","Babado Novo","Abc De Me Dar","Quero Você Do Meu Lado Pra Cantar De"
9587,"09587.mp4","Netinho","Abra A Sua Cabeça","Quero Entrar Na Sua Vida Revirar Seu"
9588,"09588.mp4","Peninha","Abre Coração","Vê Se Tira De Uma Vez"
9589,"09589.mp4","Aviões Do Forró","Abre O Som","Oi Abre O Som Do Porta Mala"
9590,"09590.mp4","Exaltasamba","Acaba Tudo Bem","La Laiá Laiá Laiá Laiá"
9591,"09591.mp4","Cartola","Acontece","Esquece O Nosso Amor Vê Se Esquece"
9592,"09592.mp4","Babado Novo","Aconteceu Você","No Dia Em Que O Amor Chegou"
9593,"09593.mp4","Netinho","Acontecimento","Você Passa"
9594,"09594.mp4","Golden Boys","Ai De Mim","Ai De Mim Querida Ai De Mim"
9595,"09595.mp4","Skank E Negra Li","Ainda Gosto Dela","Hoje Acordei Sem Lembrar Se Vivi Ou S"
9596,"09596.mp4","Cpm 22","Além De Nós","Eu Sei"
9597,"09597.mp4","Capital Inicial","Algum Dia","Ninguém Nunca Te Disse Como Ser Tão Im"
9598,"09598.mp4","Kid Abelha","Alice","Tantos Sonhos Morrem Em Poucas Palavra"
9599,"09599.mp4","Chico Rei E Paraná","Alma Transparente","Te Dei Meu Mundo Minha Vida O Meu Car"
9600,"09600.mp4","Vanessa Da Mata","Amado","Como Pode Ser Gostar De Alguém"
9601,"09601.mp4","Taiguara","Amanda","Amanda"
9602,"09602.mp4","Sorriso Maroto","Amanhã","Amanhã"
9603,"09603.mp4","Tim Maia","Amiga","Amiga"
9604,"09604.mp4","Amado Batista","Amigo Forte","Como É Linda A Vida Quando Vivida"
9605,"09605.mp4","Latino E Daddy Kall","Amigo Fura Olho","Amigo"
9606,"09606.mp4","Cesar E Paulinho","Amor Além Da Vida","Imaginei Andei"
9607,"09607.mp4","Roberta Sá","Amor Blue","Um Gato De Olhos Azuis Olhando A Lua"
9608,"09608.mp4","Daniela Mércury","Amor De Ninguém","Meu Bem Não Chore"
9609,"09609.mp4","Klb","Amor De Verdade","Entrou Na Minha Vida Feito Um Furacão"
9610,"09610.mp4","Eduardo Costa","Amor De Violeiro","Moça Eu Não Sei Falar"
9611,"09611.mp4","Jorge E Mateus","Amor Não É Jogo De Azar","Está Na Hora De Você Voltar Pra Mim"
9612,"09612.mp4","Frejat","Amor Pra Recomeçar","Eu Te Desejo Não Parar Tão Cedo"
9613,"09613.mp4","Armandinho","Analua","De Repente Uma Nuvem Encobriu A Lua"
9614,"09614.mp4","Limão Com Mel","Anjo Querubim","Fiz Você Pra Mim"
9615,"09615.mp4","Elis Regina","Aos Nossos Filhos","Perdoem A Cara Amarrada"
9616,"09616.mp4","Grupo Talagaço E Olodum","Apaixonado Por Você","Lembra Aquele Dia Azul"
9617,"09617.mp4","Banda Calypso","Arrepiou","Chegue Mais Perto"
9618,"09618.mp4","Leoni","As Cartas Que Eu Não Mando","Rio De Janeiro"
9619,"09619.mp4","Engenheiros Do Hawaí","Até O Fim","Não Vim Até Aqui Pra Desistir Agora"
9620,"09620.mp4","Luiz Carlos Magno","Ave-Maria Pro Nosso Amor","E Eu Chorei Chorei Eu Chorei"
9621,"09621.mp4","Fernando E Sorocaba","Bala De Prata","Criminosa"
9622,"09622.mp4","Aviões Do Forró","Beber, Cair E Levantar","Vamos Embora Pra Um Bar"
9623,"09623.mp4","Víctor E Léo","Borboletas","Percebo Que O Tempo Já Não Passa"
9624,"09624.mp4","Seu Jorge","Burguesinha","Vai No Cabelereiro No Esteticista"
9625,"09625.mp4","Inimigos Da Hp","Bye Bye","O Que Será Que Aconteceu"
9626,"09626.mp4","Eduardo Costa","Cachaceiro","Dizem Que Eu Sou Cachaceiro"
9627,"09627.mp4","Leonardo","Cai Na Real","Me Envenena Com Seus Beijos E Carícia"
9628,"09628.mp4","Daniel","Caipirinha","Tire Seus Olhos Da Minha Frente"
9629,"09629.mp4","Benito Di Paula","Canção De Viver Com Você","Olha Eu Que Tinha Até Um Mar Aberto"
9630,"09630.mp4","Chico Buarque","Carolina","Carolina"
9631,"09631.mp4","Companhia Do Calypso","Carro De Apaixonao","Carro De Apaixonado Tem Que Ter Um So"
9632,"09632.mp4","Amado Batista","Carta Sobre A Mesa","Deixe-Me Renascer Viver E Crescer"
9633,"09633.mp4","Nx Zero","Cartas Pra Você","Eu Tento Te Esquecer"
9634,"09634.mp4","Evinha","Casaco Marrom","Eu Vou Voltar Aos Velhos Tempos De Mim"
9635,"09635.mp4","Nx Zero","Cedo Ou Tarde","Quando Perco A Fé Fico Sem Controle"
9636,"09636.mp4","Chico Buarque E Luisa Buarque","Cem Mil Réis","Você Me Pediu Cem Mil Réis"
9637,"09637.mp4","Patrícia Marx","Certo Ou Errado","Certo Ou Errado Certo Ou Errado"
9638,"09638.mp4","Roupa Nova","Chama","Pelo Brilho Da Manhã Sinto Acesa A C"
9639,"09639.mp4","Zezé Di Camargo E Luciano","Chega","Chega De Quebrar A Cara Com Você"
9640,"09640.mp4","Luiz Melodia","Chegou A Bonitona","Mas Olha Só Oh Pessoal Que Bonitona"
9641,"09641.mp4","Fátima Guedes","Cheiro De Mato","Ai Ai O Mato O Cheiro O Céu"
9642,"09642.mp4","João Bosco E Vinícius","Chora Peito, Chora","Minha Vida Sem Você"
9643,"09643.mp4","Aviões Do Forró","Chupa Que É De Uva","Vem Meu Cajuzinho Te Dou Muito Carinh"
9644,"09644.mp4","César Menotti E Fabiano","Ciumenta","Saia Dessa Paranóia De Dizer Que Ten"
9645,"09645.mp4","Bruno E Marrone","Coisa De Pele","Se Eu Te Encontrar Por Aí"
9646,"09646.mp4","José Augusto","Coisas Do Coração","Quantas Vezes Te Falei"
9647,"09647.mp4","Milton Carlos","Contra Senso","Se Quiserem Saber Porque Foi Que Mudei"
9648,"09648.mp4","Eduardo Costa","Coração Aberto","A Gente Tem Que Conversar"
9649,"09649.mp4","Leonardo","Coração Bandido","Você Me Pergunta Por Que Estou Assim"
9650,"09650.mp4","Milton Nascimento","Coração Civil","Quero A Utopia Quero Tudo E Mais"
9651,"09651.mp4","Orlando Morais","Cruzando Raios","Estrelas Vão Fugindo Entre Os Faróis"
9652,"09652.mp4","Capital Inicial","Dançando Com A Lua","Cuidado Comigo Eu Não Sou Nenhum Sant"
9653,"09653.mp4","Nx Zero","Daqui Pra Frente","Estou Aqui Pra Dizer Que Eu Jamais"
9654,"09654.mp4","Jorge E Mateus","De Tanto Te Querer","Larga Tudo E Vem Correndo"
9655,"09655.mp4","Alexandre Pires E Revelação","Delírios De Amor","Me Lembro O Dia Que Cheguei"
9656,"09656.mp4","Chico Buarque","Desalento","Sim Vai E Diz"
9657,"09657.mp4","Djavan","Desandou","Me Diga Já O Que Foi Que Aconteceu"
9658,"09658.mp4","Djavan","Desenho De Giz","Quem Quer Viver Um Amor"
9659,"09659.mp4","Belo","Desse Jeito É Ruim Pra Mim","Eu Aqui Olhando O Telefone"
9660,"09660.mp4","João Neto E Frederico","Difícil","Difícil Não Pensar"
9661,"09661.mp4","Daniel","Difícil Não Falar De Amor","Eu Já Te Escrevi Mil Cartas"
9662,"09662.mp4","Scracho","Divina Comédia","Ahhhh..."
9663,"09663.mp4","Os Originais Do Samba","Do Lado Direito Da Rua Direita","Do Lado Direito Da Rua Direita"
9664,"09664.mp4","César Menotti E Fabiano","Do Lado Esquerdo","Tem Uma Paixão Morando Aqui Do Lado"
9665,"09665.mp4","Danni Carlos","Doce Sal","Tem Que Amar Com Fé Tem Que Morrer De"
9666,"09666.mp4","Simoninha","É Bom Andar A Pé","É Bom Andar A Pé"
9667,"09667.mp4","Biquini Cavadão","Em Algum Lugar Do Tempo","Não Guarde Mágoa De Mim"
9668,"09668.mp4","Leonardo","Escorpião","Eu Quero Ver Essa Mulher Chorando De"
9669,"09669.mp4","Moinho Da Bahia","Esnoba","Só Porque Tenho Por Ela Um Apreço Im"
9670,"09670.mp4","Tânia Cristal","Esquisito","Eu Já Vi Você Em Tantos Lugares"
9671,"09671.mp4","Emílio Santiago","Essa Fase Do Amor","Essa Fase Do Amor É Bonita Demais"
9672,"09672.mp4","Rita Lee","Esse Tal De Roque Enrow","Ela Nem Vem Mais Pra Casa Doutor"
9673,"09673.mp4","Núbia Lafayette","Esta Noite Eu Queria Que O Mundo","Esta Noite Eu Queria Que O Mundo Aca"
9674,"09674.mp4","Eduardo Costa","Eu Aposto","Eu Aposto"
9675,"09675.mp4","Eduardo Costa","Eu Duvido","Você Pode Revirar O Mundo"
9676,"09676.mp4","Ana Carolina","Eu Que Não Sei Quase Nada Do Mar","Garimpeira Da Beleza"
9677,"09677.mp4","Amado Batista","Eu Quero É Namorar","Eu Pensei"
9678,"09678.mp4","Chico Buarque","Eu Te Amo","Ah Se Já Perdemos A Noção Da Hora"
9679,"09679.mp4","Waldick Soriano","Eu Vou Ter Sempre Você","Você Jamais Saberá Querida"
9680,"09680.mp4","Edson E Hudson","Fala","Fala Que Entendi Errado"
9681,"09681.mp4","Ritchie","Fala","Eu Não Sei Dizer Nada Por Dizer"
9682,"09682.mp4","Sorriso Maroto","Fica Combinado Assim","Fico Pensando Um Jeito De Te Falar"
9683,"09683.mp4","Víctor E Léo","Fotos","Joguei Fora Fotos De Nós Dois"
9684,"09684.mp4","Bruno E Marrone","Hoje Eu Não Tô Pra Ninguém","Hoje Eu Amanheci Machucado De Paixão"
9685,"09685.mp4","Rick E Renner","Homem Carente","Tô Precisando Tanto De Um Olhar Assim"
9686,"09686.mp4","O Rappa","Hóstia","Os Que Sobravam Encostados No Balcão"
9687,"09687.mp4","Julieta Venegas E Marisa Monte","Ilusion","Uma Vez Eu Tive Uma Ilusão"
9688,"09688.mp4","Pixote","Insegurança","Essa Noite Eu Notei Que Você Demorou"
9689,"09689.mp4","Víctor E Léo","Jogo Da Vida","Ela Estava Linda Em Plenitude Infin"
9690,"09690.mp4","Zé Ramalho","Kriptônia","Não Admito Que Me Fale Assim"
9691,"09691.mp4","Víctor E Léo","Lembranças De Amor","Veja Só"
9692,"09692.mp4","Tom Jobim","Lígia","Eu Nunca Sonhei Com Você"
9693,"09693.mp4","João Bosco E Vinícius","Magia","No Teu Olhar"
9694,"09694.mp4","Hugo Pena E Gabriel","Mala Pronta","Você Passou Da Conta E Me Tirou Do Sé"
9695,"09695.mp4","Agostinho Dos Santos","Manhã De Carnaval","Manhã Tão Bonita Manhã"
9696,"09696.mp4","Wanessa Camargo","Me Abrace (Abrázame)","Saiba Que Este É Meu Último Pedido"
9697,"09697.mp4","Grupo Revelação","Medo De Amar","Fica No Faz De Conta"
9698,"09698.mp4","Pixote","Meu Amor","Minha Pele Sente Frio Sem Você"
9699,"09699.mp4","Cesar E Paulinho","Meu Endereço","Eu Vou Lhe Dar O Endereço Onde Moro"
9700,"09700.mp4","O Rappa","Meu Santo Ta Cansado","Ô Na Na Na Ô Na Na Na Ô Na Na Na"
9841,"09841.mp4","O Rappa","Monstro Invisível","Monstro Invisível Que Comanda A Horda"
9842,"09842.mp4","Chico Buarque","Morena Dos Olhos D'Água","Morena Dos Olhos D'Água"
9843,"09843.mp4","Armandinho","Morena Nativa","Morena Nativa Desde Criança"
9844,"09844.mp4","Zé Henrique E Gabriel","Morro De Saudade","Morro De Saudade Longe Do Seu Beijo"
9845,"09845.mp4","Secos E Molhados","Mulher Barriguda","Mulher Barriguda Que Vair Ter Menino"
9846,"09846.mp4","Adriana Calcanhoto","Mulher Sem Razão","Saia Dessa Vida De Migalhas"
9847,"09847.mp4","Marisa Monte","Não É Proibido","Jujuba Bananada Pipoca"
9848,"09848.mp4","Bruno E Marrone","Não Faz Mais Isso Comigo","Não Faz Mais Isso Comigo"
9849,"09849.mp4","Arnaldo Antunes E Nando Reis","Não Vou Me Adaptar","Eu Não Caibo Mais Nas Roupas Que Eu Ca"
9850,"09850.mp4","Rick E Renner","Negativo, Positivo","Às Vezes Quero Que Você Se Dane"
9851,"09851.mp4","Nando Reis E Negra Li","Negra Livre","Está Com Todo Som Na Boca Nas Palavra"
9852,"09852.mp4","Luiza Possi","Nem Bem Acordo","Nem Bem Acordo Já Espio Teu Retrato"
9853,"09853.mp4","Rick E Renner","Nossa Senhora Aparecida","Ó Senhora Aparecida Rainha Da Minha"
9854,"09854.mp4","Cartola","O Mundo É Um Moinho","Ainda É Cedo Amor"
9855,"09855.mp4","Os Originais Do Samba","O Ouro E A Madeira","O Ouro Afunda No Mar No Mar"
9856,"09856.mp4","Tânia Mara","O Que Eu Sinto","Simplesmente Não Posso Negar"
9857,"09857.mp4","Fábio Júnior","Obrigado","Obrigado Por Ter Me Concedido A Vida"
9858,"09858.mp4","Rodriguinho","Palavra De Amigo","Quantas Vezes Eu Vou Ter Que Te Falar"
9859,"09859.mp4","Claudia Leite","Pássaros","Eu Conheço A Imensidão Do Céu"
9860,"09860.mp4","Rick E Renner","Passe O Tempo Que Passar","Tudo Que Ficou Depois Que A Gente Ter"
9861,"09861.mp4","João Neto E Frederico","Pega Fogo Cabaré","Mas Pega Fogo Cabaré"
9862,"09862.mp4","As Frenéticas","Perigosa","Sei Que Eu Sou Bonita E Gostosa"
9863,"09863.mp4","Jorge E Mateus","Pode Chorar","Quase Que Acabo Com A Minha Vida"
9864,"09864.mp4","Benito Di Paula","Proteção Às Borboletas","Eu Sou Como A Borboleta"
9865,"09865.mp4","Paulinho Moska","Quantas Vidas Você Tem","Meu Amor"
9866,"09866.mp4","Daniel","Quase Louco","Lá Fora A Chuva Cai"
9867,"09867.mp4","Daniel","Que Qui Tem, Que Qui Tem","Chega De Blá Blá Blá Chega De Nhém Nhém"
9868,"09868.mp4","Maria Bethânia","Reconvexo","Eu Sou A Chuva Que Lança A Areia Do"
9869,"09869.mp4","Fágner","Romance No Deserto","Eu Tenho A Boca Que Arde Como O Sol"
9870,"09870.mp4","Banda Eva","Rua 15","Ô Subá Subaiôba Oba Oba Oba"
9871,"09871.mp4","Luiz Gonzaga","Sabiá","A Todo Mundo Eu Dou Psiu"
9872,"09872.mp4","Benito Di Paula","Sanfona Branca","Aquela Sanfona Branca"
9873,"09873.mp4","Edson E Hudson","Saudade","Saudade Bate No Peito Ela Vem Pra Ma"
9874,"09874.mp4","Mateus E Cristiano","Se É Pra Falar De Amor","Se É Pra Falar De Amor Eu Sou Mesmo A"
9875,"09875.mp4","Brilho De Neon","Se Enganou","Se Enganou"
9876,"09876.mp4","D'Black","Sem Ar","Meus Pés Não Tocam Mais O Chão"
9877,"09877.mp4","Víctor E Léo","Sem Você","Nas Incertezas De Um Caminho Que É Tã"
9878,"09878.mp4","Ovelha","Sem Você Não Viverei","Ou Ou Ei Ei Sem Você Não Viverei"
9879,"09879.mp4","Simone","Separação","Melhor Assim A Gente Já Não Se Entendia Muito"
9880,"09880.mp4","Amado Batista","Seresteiro Das Noites","Existem Momentos Na Vida Que Lembramo"
9881,"09881.mp4","Víctor E Léo","Sinto Falta De Você","Parecia Muito Fácil"
9882,"09882.mp4","Rionegro E Solimões","Só Eu Sei","Se É Pra Valer Ou Não"
9883,"09883.mp4","Julio Iglesias","Só Você Vai Me Fazer Feliz","Hoje Eu Sei E Não Vou Mentir"
9884,"09884.mp4","João Bosco E Vinícius","Sufoco","Eu Sei Que É Amor E Sinto Pra Valer"
9885,"09885.mp4","Gilberto E Gilmar","Tá Ruim Mas Tá Bom","Pra Todo Problema Existe Solução"
9886,"09886.mp4","Gian E Giovani","Taça De Pranto","À Noite É Tudo Solidão Em Mim"
9887,"09887.mp4","Teodoro E Sampaio","Tapete Da Sala","Não Precisa Mais Dizer Que Me Ama"
9888,"09888.mp4","Jammil","Tchau I Have To Go Now","Tchau"
9889,"09889.mp4","Rick E Renner","Te Amo, Pai","Pai Senta Aqui Comigo Que Eu Quero Ol"
9890,"09890.mp4","Edson E Hudson","Te Quero Pra Mim","Chego Em Casa Já É De Manhã"
9891,"09891.mp4","Trio Parada Dura","Telefone Mudo","Eu Quero Que Risque O Meu Nome Da Sua"
9892,"09892.mp4","Jorge E Mateus","Tem Nada A Ver","Alguém Me Disse Que Você Falou"
9893,"09893.mp4","Víctor E Léo","Tem Que Ser Você","Um Dia Seus Pés Vão Me Levar"
9894,"09894.mp4","Zé Henrique E Gabriel","Tem Tudo A Ver","Tem Tudo A Ver Tudo A Ver Eu E Você"
9895,"09895.mp4","Jeito Moleque","Teu Segredo","Como Eu Pude Um Dia Me Apaixonar Por"
9896,"09896.mp4","João Bosco E Vinícius","Tô Falando Sério","Você Não Tem Limite Você Não Tem Hora"
9897,"09897.mp4","Kid Abelha","Todo Meu Ouro","De Longe Eu Penso Em Você"
9898,"09898.mp4","Ana Carolina","Tolerância","Como Água No Deserto"
9899,"09899.mp4","Rionegro E Solimões","Traz Mais Uma","Traz Mais Uma Aê Que Aquela Já Acabo"
9900,"09900.mp4","Sérgio Reis","Triste Berrante","Já Vai Bem Longe Esse Tempo"
9901,"09901.mp4","Papas Na Língua","Um Dia De Sol","Você Falou Que Não Ia Fugir"
9902,"09902.mp4","D'Black E Negra Li","Um Minuto","Olha Eu Só Tenho Um Minuto"
9903,"09903.mp4","Cpm 22","Um Minuto Para O Fim Do Mundo","Me Sinto Só"
9904,"09904.mp4","Fresno","Uma Música","Apago As Memórias Que Não Vão Voltar"
9905,"09905.mp4","Zeca Pagodinho","Uma Prova De Amor","Manda Que Eu Faço Chover Pede Que Eu"
9906,"09906.mp4","Gian E Giovani","Vai Pescar Moçada","Já Pagou O Que Devia Tá Tranquilo E"
9907,"09907.mp4","Grupo Revelação","Velocidade Da Luz","Eu Já Não Sei Mais Por Que Vivo A Sofr"
9908,"09908.mp4","Chimarruts","Versos Simples","Uhh Yeh Ah Ah Ah"
9909,"09909.mp4","Rionegro E Solimões","Vida Louca","Eu Não Quero Nem Saber Dessa Vida Lou"
9910,"09910.mp4","Sorriso Maroto","Você Me Maltrata","Já Me Dei Demais Sem Receber"
9989,"09989.mp4","Double You","We All Need Love","We All Need Love We All Need Love"
9990,"09990.mp4","Oingo Boingo","We Close Our Eyes","We Close Our Eyes"
9991,"09991.mp4","Pet Shop Boys","West End Girls","Sometimes You'Re Better Off Dead"
9992,"09992.mp4","Norah Jones","What Am I To You","What Am I To You Tell Me Darlin' True"
9993,"09993.mp4","Vanessa Anne Hudgens","What I'Ve Been Looking For","It'S Hard To Believe That I Couldn'T See"
9994,"09994.mp4","High School Musical","When There Was Me And You","It'S Funny When You Find Yourself"
9995,"09995.mp4","Hannah Montana","Who Said","I'M More Than Just You'Re Average Girl"
9996,"09996.mp4","Scorpions","Wind Of Change","I Follow The Moskva Down To Gorky Park"
9997,"09997.mp4","High School Musical","You Are The Music In Me","Na Na Na Na Na Na Na Na Yeah"
9998,"09998.mp4","Neil Sedaka","You Mean Everything To Me","You Are The Answer To My Lonely Prayer"
9999,"09999.mp4","John Travolta & Olivia Newton John","You'Re The One That I Want","I Got Chills They'Re Multiplyin'"
15001,"15001.mp4","Gusttavo Lima","60 Segundos","Me Dê Um Minuto Pra Falar Que Eu Preciso"
15002,"15002.mp4","Fernando E Sorocaba","A Verdade","Diz Pra Ela Que Eu Mudei De Cidade"
15003,"15003.mp4","Thaeme E Thiago","Ai Que Dó","Foi Se Aventurar E Agora Ficou Só Ai Que Dó"
15004,"15004.mp4","Harmony Cats","Amigo É","É Amigo É Um Passarinho Que Vem Te"
15005,"15005.mp4","Naldo Benny (Naldo)","Amor De Chocolate","Vodca Ou Água De Coco Pra Mim Tanto Faz"
15006,"15006.mp4","Benito Di Paula","Assobiar Ou Chupar Cana","Seria Muito Bom Seria Muito Legal"
15007,"15007.mp4","Chitãozinho E Xororó","Ave Maria","Ave Maria Mãe Abençoada Virgem Imaculada"
15008,"15008.mp4","Fernanda Takai","Canta Maria","Canta Maria A Melodia Singela"
15009,"15009.mp4","Xuxa","Doce Mel","Bom Estar Com Você Brincar Com Você"
15010,"15010.mp4","Jorge E Mateus","Duas Metades","Pra Falar Do Amor De Verdade Vou Começar"
15011,"15011.mp4","Biquini Cavadão","Escuta Aqui","Escuta Aqui Eu Não Sou Culpado De Tudo"
15012,"15012.mp4","Roberto Carlos","Furdúncio","Onde Ela Vai Eu Vou Onde Ela Está Eu Estou"
15013,"15013.mp4","Galinha Pintadinha","Galinha Pintadinha","Pó Pó Pó... A Galinha Pintadinha E O Galo"
15014,"15014.mp4","Gusttavo Lima","Gatinha Assanhada","Gatinha Assanhada Cê Ta Querendo O Que"
15015,"15015.mp4","Sergio Malandro","O Escândalo (Um Capeta Em Forma De Guri)","Conheci Um Capeta Em Forma De Guri"
15016,"15016.mp4","Jorge E Mateus","O Que É Que Tem","E Pra Deixar Acontecer A Pena Tem Que Valer"
15017,"15017.mp4","Fresno","Pólo","Se Eu Te Disser Que Foi Difícil Te Esquecer"
15018,"15018.mp4","Paolo","Tanta Coisa","Esse Olhar De Lua Crescente"
15019,"15019.mp4","Raul Seixas","Tapanacara","Urucubaca Mandinga Ataca Mexe E Me"
15020,"15020.mp4","João Neto E Frederico","Te Amo E Nada Mais","Teus Olhos O Teu Jeito A Sua Voz Fala"
15021,"15021.mp4","Milionário E José Rico","A Gangorra","Eu Gostaria De Voltar Aos Quinze Anos"
15022,"15022.mp4","Alcione","A Paixão Tem Memória","Lá Vem Você De Novo Procurar Por Mim"
15023,"15023.mp4","Chico Buarque","A Rita","A Rita Levou Meu Sorriso No Sorriso Dela"
15024,"15024.mp4","Benito Di Paula","Além De Tudo","Você Ficou Sem Jeito E Encabulada"
15025,"15025.mp4","Martinho Da Vila","Aquarela Brasileira","Vejam Esta Maravilha De Cenário"
15026,"15026.mp4","Marisa Monte","Aquela Velha Canção","Quando Eu Te Ligar Cantando Aquela Velha"
15027,"15027.mp4","Fernando E Sorocaba","Até O Final","No Começo Eu Tentava Te Fazer Me Ama"
15028,"15028.mp4","Zeca Baleiro","Calma Aí, Coração","Eu Já Falei Tantas Vezes E Você Nada De"
15029,"15029.mp4","Chico Buarque","Ciranda Da Bailarina","Procurando Bem Todo Mundo Tem Pereba"
15030,"15030.mp4","Munhoz E Mariano","Comendo Água","Alô Tô Num Bar Chego Já Pode Ir Fazendo"
15031,"15031.mp4","Ivete Sangalo - Shakira","Dançando","Mamãe Vai Fazer Papai Vai Fazer"
15032,"15032.mp4","Maria Gadú","Dona Cila","De Todo O Amor Que Eu Tenho"
15033,"15033.mp4","Cristiano Araujo - Gusttavo Lima","É Fato","Estou Tentando Manter Esse Amor Esque"
15034,"15034.mp4","Munhoz E Mariano","Fim De Semana","Alô O Final De Semana Chegou"
15035,"15035.mp4","Jorge E Mateus","Flor","Flor Ô U Ô Ô... Flor Pra Onde For Você For"
15036,"15036.mp4","Claudia Leitte","Largadinho","Eu Já Falei Pra Você Deixar De Maresia"
15037,"15037.mp4","Galinha Pintadinha","Mariana","Mariana Conta Um Mariana Conta Um"
15038,"15038.mp4","Paulo Sérgio","Meu Filho Deus Que Lhe Proteja","Eu Recordo Com Felicidade Dia Mês E Hora"
15039,"15039.mp4","Chico Buarque","Retrato Em Branco E Preto","Já Conheço Os Passos Dessa Estrada"
15040,"15040.mp4","Nando Reis","Sei","Sabe Quando A Gente Tem Vontade"
15041,"15041.mp4","Leno","A Festa Dos Seus Quinze Anos","Na Festa Dos Seus Quinze Anos"
15042,"15042.mp4","Lia Sophia","Ai Menina","Menina O Que Fazer Com Seu Rebolado"
15043,"15043.mp4","Seu Jorge","Alma De Guerreiro","Jorge Vem De Lá Da Capadócia"
15044,"15044.mp4","Sandy","Aquela Dos 30","Hoje Já É Quinta-Feira E Eu Já Tenho Quase 30"
15045,"15045.mp4","Wilson E Soraia","Cansei De Chorar","Tô Cansado De Cho Cho Cho Chorar"
15046,"15046.mp4","Fábio Jr.","Choro","Tem Hora Que Bate Uma Tristeza Tão Grande"
15047,"15047.mp4","Manu Gavassi","Conto De Fadas","Já É Tarde E Eu Aqui Prolongando O Fim"
15048,"15048.mp4","Jerry Adriani","Coração De Cristal (Corazón De Cristal)","Lara Lala... Meu Coração É De Cristal"
15049,"15049.mp4","Abílio Farias","Coração Indeciso","Um Coração Indeciso Busquei No Céu Um"
15050,"15050.mp4","Chico Buarque","Geni E O Zepelim","De Tudo Que É Nego Torto Do Mangue E Do Cais"
15051,"15051.mp4","The Fevers","Guerra Dos Sexos","Cheguei Pra Conquistar O Mundo"
15052,"15052.mp4","Nilton César","Lilian","Lílian Teus Olhinhos Verdinhos Falam Me"
15053,"15053.mp4","Mart'Nália","Namora Comigo","Hoje Eu Estou Sozinha Você Está Na Minha"
15054,"15054.mp4","Paulo Sérgio","Não Creio Em Mais Nada","Não Sei O Que Faço A Minha Vida É Uma Luta"
15055,"15055.mp4","Gilliard","Nosso Juramento","Não Posso Ver-Te Triste Porque Me Mata"
15056,"15056.mp4","Manu Gavassi","Odeio","Eu Odeio O Seu Sorriso E Seu Jeito De Falar"
15057,"15057.mp4","Roberta Sá","Pelas Tabelas","Ando Com Minha Cabeça Já Pelas Tabelas"
15058,"15058.mp4","Chimarruts","Quando O Amor Bate A Porta","Sorria Amor Que O Melhor Ainda Está Por Vir"
15059,"15059.mp4","Padre Fábio De Melo","Seu Amor É Demais","Sei Que O Seu Coração Dói Sei Que O Mundo"
15060,"15060.mp4","The Originals","Uma História Pra Ficar","Quando Estou Nos Teus Braços Fecho Os Olhos"
15061,"15061.mp4","Isabella Taviani","A Canção Que Faltava","Eu Não Sabia Mais Sonhar"
15062,"15062.mp4","Thiaguinho","Ainda Bem","Ainda Bem Que Te Encontrei"
15063,"15063.mp4","Larissa Manoela","Beijo, Beijinho, Beijão","Beijo Beijo Beijo Beijo Beijinho Beijão"
15064,"15064.mp4","Bruno E Marrone","Como Eu Chorei","Eu Nunca Pensei Que Tivesse Fim"
15065,"15065.mp4","Milionário E José Rico","Corpo E Alma","Quando Precisaste De Mim Lhe Dei Apoio E Guarida"
15066,"15066.mp4","Nara Leão","Diz Que Fui Por Ai","Se Alguém Perguntar Por Mim Diz Que Fui Por Aí"
15067,"15067.mp4","Guilherme E Santiago","Do Outro Lado Da Cidade","Hoje Vou Voltar De Madrugada"
15068,"15068.mp4","Maria Gadú","Estranho Natural","Será Que Te Conheço Desde A Infância"
15069,"15069.mp4","Isabella Taviani","Eu Não Moro Na Sua Vida","Eu Tenho Mais O Que Fazer Do Que Me Enganar"
15070,"15070.mp4","Chitãozinho E Xororó","Faz Um Ano","Se Eu Pudesse Te Contar Como Eu Sofro Noite E Dia"
15071,"15071.mp4","Biquini Cavadão","Impossível","Tudo Bem Quando Termina Bem"
15072,"15072.mp4","Chico Rey E Paraná","Leão Domado","Você É A Maior Paixão Que Eu Tenho Em Minha Vida"
15073,"15073.mp4","Vanusa","Mudanças","Hoje Eu Vou Mudar Vasculhar Minhas Gavetas"
15074,"15074.mp4","Charlie Brown Jr. - Negra Li","Não É Sério","Eu Vejo Na Tv O Que Eles Falam Sobre O Jovem Não É Sério"
15075,"15075.mp4","Chico Rey E Paraná","Não São Só Palavras Lindas","É Por Nada Que Eu Te Quero É Por Tudo Que Me Dás"
15076,"15076.mp4","Cesar Sampaio","Secretária Da Beira Do Cais","Ela Espera E Não Desespera Na Beira Do Cais"
15077,"15077.mp4","Falamansa","Solução (Essa É Pra Vocês)","Eu Nem Dormi Direito Isso Não É Defeito"
