"code","name","Artista","Musica","Letra"
6374,"06374.mp4","Cidade Negra","Girassol","Tchuru...A Favor Da Comunidade..."
6375,"06375.mp4","Débora Blando","Innocence","O Céu Esconde O Que Eu Queria Ver..."
6376,"06376.mp4","Lilian","Lacinhos Cor-De-Rosa (Pink Shoe L","Atenho Um Amor Puro E Verdadeiro..."
6377,"06377.mp4","Marisa Monte","Lenda Das Sereias Rainha Do Mar","Oguntê Marabô Caiala E Sobá..."
6378,"06378.mp4","Charlie Brown Jr.","Lugar Ao Sol","Que Bom Viver Como É Bom Sonhar..."
6379,"06379.mp4","Placa Luminosa","Mais Uma Vez","Telefono Te Procuro..."
6380,"06380.mp4","Ronaldo Resedá","Marrom Glacê","Chanpagne No Gelo Salgados E Doces..."
6381,"06381.mp4","Zezé Di Camargo E Luciano","Menino Cantador","Sou Menino Cantador Que Só Quer Falar..."
6382,"06382.mp4","Ivan Lins","Novo Tempo","No Novo Tempo Apesar Dos Castigos..."
6383,"06383.mp4","Márcio Greyck","O Mais Importante É O Verdadeiro","Quanto Sinto Em Dizer-Te Que Me Podes..."
6384,"06384.mp4","Belo","Resumo Da Felicidade","Eu Agradeço A Deus Por Existir Você..."
6385,"06385.mp4","Kid Abelha","Seu Espião","Uh Uh Uh... Ver Você Dormir..."
6386,"06386.mp4","Klb","Seu Nome","Quando Escuto A Sua Voz..."
6387,"06387.mp4","Roberto Carlos","Sua Estupidez","Meu Bem Meu Bem Você Tem Que..."
6388,"06388.mp4","Skank","Tanto","Coveiros Gemem Tristes..."
6389,"06389.mp4","Com 22","Tarde De Outubro","Peguei Minhas Coisas E Fui Embora..."
6390,"06390.mp4","Marlon E Maicon","Te Peço Fica Comigo","Escuta Meu Amor..."
6391,"06391.mp4","Los Hermanos","Todo Carnaval Tem Seu Fim","Todo Dia Um Ninguém José Acorda Já..."
6392,"06392.mp4","Pedro E Thiago","Toque De Mágica","Quando A Noite Chegar Tô Pensando..."
6393,"06393.mp4","Mário Veloso","Tudo Por Você","Por Muitas Vezes Já Tentei Dizer..."
6394,"06394.mp4","Twister","Um Beijo Seu","Às Vezes Eu Me Lembro..."
6395,"06395.mp4","Bruno E Marrone","Um Bom Perdedor","Sei Que Você Pensa Em Me Deixar..."
6396,"06396.mp4","Chitãozinho E Xororó","Um Sonho De Amor","De Onde Vem Esse Amor Tão Intenso..."
6397,"06397.mp4","Ricardo Braga","Uma Estrela Vai Brilhar","Uma Estrela Vai Brilhar No Meu Caminho..."
6398,"06398.mp4","Sandy E Júnior","Vamo Pulá","Estou Sentindo Solta Pelo Ar..."
6399,"06399.mp4","Gue Tsu","Vazio","Outra Vez Ouvi Você Dizer..."
6400,"06400.mp4","Jessé","Voa Liberdade","Voa Voa Minha Liberdade..."
6401,"06401.mp4","Leonardo","A Distância","Nunca Mais Você Ouviu Falar Em Mim..."
6402,"06402.mp4","A Cor Do Som","Abri A Porta","Abri A Porta Apareci..."
6403,"06403.mp4","Kelly Key","Anjo","Mais Uma Noite Chega E Com Ela..."
6404,"06404.mp4","Zeca Pagodinho","Bagaço Da Laranja","Fui Num Pagode Acabou A Comida..."
6405,"06405.mp4","Leandro Lehart","Camila Bandida","Essa É A História..."
6406,"06406.mp4","Skank","Canção Noturna","Misterioso Luar De Fronteira..."
6407,"06407.mp4","Ls Jack","Carla","Eu Cheguei A Deixar..."
6408,"06408.mp4","Claudinho E Buchecha","Coisa De Cinema","Hoje Tudo Tem Que Ser Legal..."
6409,"06409.mp4","Vavá","Convite De Casamento","A Gente Morou E Cresceu Na Mesma Rua..."
6410,"06410.mp4","Os Travessos","Distância","Tanto Tempo Longe..."
6411,"06411.mp4","Pedro E Thiago","É Melhor Assim","Eu Só Vim Pra Te Falar Good Bye Good..."
6412,"06412.mp4","Gino E Geno","Ela Chorou De Amor","Ela Sentiu Saudade Ela Me Ligou..."
6413,"06413.mp4","Ana Carolina","Ela É Bamba","Ela É Bamba Ela É Bamba Ela É Bamba..."
6414,"06414.mp4","Wanderléia","Eu Já Nem Sei","Eu Já Nem Sei..."
6415,"06415.mp4","Djavan","Faltando Um Pedaço","O Amor É Um Grande Laço..."
6416,"06416.mp4","Patrícia Marx","Festa Do Amor","Uô Uô... No Livro De Leitura Que Você..."
6417,"06417.mp4","Wanessa Camargo","Gostar De Mim","Eu Vi O Céu Tão Claro..."
6418,"06418.mp4","Revelação","Grades Do Coração","Quando Eu Te Vi Pela Primeira Vez..."
6419,"06419.mp4","Engenheiros Do Hawaii","Infinita Highway","Você Me Faz Correr Demais...."
6420,"06420.mp4","Beto Guedes","Maria Solidária","Eu Choro De Cara Suja...."
6421,"06421.mp4","Vanusa","Mensagem","Quando O Carteiro Chegou..."
6422,"06422.mp4","Altemar Dutra","Meu Velho (Mi Viejo)","É Um Bom Tipo Meu Velho E Anda Só..."
6423,"06423.mp4","Jota Quest","Na Moral","Na Moral Na Moral Só Na Moral...."
6424,"06424.mp4","Orlando Silva","Nada Além","Nada Além Nada Além De Uma Ilusão..."
6425,"06425.mp4","Roberto Carlos","Negro Gato","Eu Sou O Negro Gato De Arrepiar..."
6426,"06426.mp4","Zezé Di Camargo E Luciano","Nem Mais Uma Dúvida","Quero Acabar Com Essa Dúvida...."
6427,"06427.mp4","Claudio Zoli","Noite Do Prazer","A Noite Vai Ser Boa...."
6428,"06428.mp4","Sandy E Júnior","O Amor Nos Guiará","Vamos Ter Momentos A Chorar..."
6429,"06429.mp4","Cássia Eller","O Meu Mundo Ficaria Completo (Co","Não É Porque Eu Sujei A Roupa..."
6430,"06430.mp4","Ivete Sangalo","Penso","Penso Penso Penso Penso Penso...."
6431,"06431.mp4","Bruno E Marrone","Programa De Fim De Semana","Não Me Deixe Fora Da Sua Agenda...."
6432,"06432.mp4","Luan E Vanessa","Quatro Semanas De Amor","Foi Um Sonho De Verão Numa Praia..."
6433,"06433.mp4","Chico Buarque","Roda Viva","Tem Dias Que A Gente Se Sente..."
6434,"06434.mp4","Maurício Manieri","Se Quer Saber","Te Prometi Nunca Te Deixar..."
6435,"06435.mp4","Biafra","Sonho De Ícaro","Voar Voar Subir Subir Ir Por Onde For...."
6436,"06436.mp4","Sérgio E Tchelo","Te Busquei Nas Avenidas","Já É Tarde Tá Chovendo É Madrugada..."
6437,"06437.mp4","Rionegro E Solimões","Tô Por Aí","Tô Por Aí..."
6438,"06438.mp4","Lulu Santos","Todo Universo","Minha Favorita Chegou Esta Pra Você...."
6439,"06439.mp4","Caetano Veloso","Trilhos Urbanos","O Melhor O Tempo Esconde..."
6440,"06440.mp4","Rpm","Vida Real","Se Você Pudesse Me Dizer..."
6441,"06441.mp4","Beth Carvalho","1800 Colinas","Subi Mais De Mil E Oitocentas Colinas..."
6442,"06442.mp4","Zezé Di Camargo E Luciano","A Ferro E Fogo","A Ferro E Fogo Não Dá..."
6443,"06443.mp4","Alexandre Pires","A Musa Das Minhas Canções","No Palco De Um Pequeno Bar..."
6444,"06444.mp4","Claudia Telles","A Noite Vai Chegar","A Noite Vai Chegar..."
6445,"06445.mp4","Capital Inicial","A Sua Maneira","Ela Dormiu No Calor Dos Meus Braços..."
6446,"06446.mp4","Zé Ramalho","Avohai","Um Velho Cruza A Soleira De Botas..."
6447,"06447.mp4","Arlindo Farias","Bicho Do Mato","Sou Bicho Feito Do Mato Não Tenho..."
6448,"06448.mp4","Bruno E Marrone","Bijuteria","Quando A Noite Cai..."
6449,"06449.mp4","Elza Soares","Cadeira Vazia","Entra Meu Amor Fica À Vontade..."
6450,"06450.mp4","Uns E Outros","Carta Aos Missionários","Missionários De Um Mundo Vagam..."
6451,"06451.mp4","Dallas Company","Clima De Rodeio","A Magia Está No Ar Vejo Fogo..."
6452,"06452.mp4","Alceu Valença","Como Dois Animais","Uma Moça Bonita De Olhar Agateado..."
6453,"06453.mp4","Dino E Deny","Coruja","Coruja O Nome Que Eu Dei Àquele..."
6454,"06454.mp4","Agepê","Deixa Eu Te Amar","Quero Ir Na Fonte Do Teu Ser..."
6455,"06455.mp4","Luiza Possi","Dias Iguais","Se Eu Quiser Me Convencer..."
6456,"06456.mp4","Angelo Máximo","Domingo Feliz (Beautiful Sunday)","Meu Domingo Alegre Vai Ser..."
6457,"06457.mp4","Fama Coral","Esperança","Quem Aqui Chegou Quem Aqui Chegar..."
6458,"06458.mp4","Laura Pausini E Alejandro Sanz","Esperança (4 Idiomas)","Quien Aquí Llegó Y Quien Va Allegar..."
6459,"06459.mp4","Rionegro E Solimões","Estrela Guia","Eu Não Sei..."
6460,"06460.mp4","Nenhum De Nós","Eu Caminhava","Eu Caminhava..."
6461,"06461.mp4","Chitãozinho E Xororó","Eu E O Sabiá","Ai Quem Me Dera Sabiá Também..."
6462,"06462.mp4","João Bosco","Jade","Aqui Meu Irmão Ela É Coisa Rara..."
6463,"06463.mp4","Djavan E Cássia Eller","Milagreiro","Agora Vamos Ter Os Girassóis..."
6464,"06464.mp4","Fagner","Muito Amor","Amor Febril Amor Viril Amor Adolesce..."
6465,"06465.mp4","Marina Lima","Notícias","Só Você Pode Me Incendiar..."
6466,"06466.mp4","Clara Becker","Novamente","Me Disse Vai Embora Eu Não Fui..."
6467,"06467.mp4","Rouge E Klb","Nunca Deixe De Sonhar","Há Uma Luz Em Algum Lugar..."
6468,"06468.mp4","Milton Nascimento","O Cio Da Terra - Com Chico Buarque","Debulhar O Trigo..."
6469,"06469.mp4","Titãs","O Mundo É Bão Sebastião","Porque O Sol Saiu Porque O Seu Dente..."
6470,"06470.mp4","Elis Regina","O Que Foi Feito Deverá","O Que Foi Feito Amigo..."
6471,"06471.mp4","Rpm","Onde Está O Meu Amor","Onde Está O Meu Amor..."
6472,"06472.mp4","Vanessa Da Mata","Onde Ir","Eu Não Sei O Que Vi Aqui Eu Não Sei..."
6473,"06473.mp4","Jorge Vercilo","Que Nem Maré","Faz Um Tempão..."
6474,"06474.mp4","Frejat","Segredos","Eu Procuro Um Amor Que Ainda Não..."
6475,"06475.mp4","Biquíni Cavadão","Tédio","Alô.. Sabe Esses Dias Em..."
6476,"06476.mp4","Chico César","Templo","Se Você Olha Pra Mim Se Me Dá..."
6477,"06477.mp4","Benito De Paula","Tudo Está No Seu Lugar","Tudo Está No Seu Lugar..."
6478,"06478.mp4","Metrô","Tudo Pode Mudar","Nada Ultrapassa A Velocidade Do..."
6479,"06479.mp4","Leonardo","Vem Sonhar","Como Você Está Bela Tão Bela..."
6480,"06480.mp4","Pena Branca E Xavantinho","Viola Quebrada","Quando Da Brisa...."
6481,"06481.mp4","Klb","A Cada Dez Palavras","Faz Tanto Tempo Que Eu Venho Te..."
6482,"06482.mp4","Cidade Negra","A Estrada","Você Não Sabe O Quanto Eu Caminhei..."
6483,"06483.mp4","Débora Blando","A Luz Que Acende O Olhar","A Luz Que Acende O Olhar..."
6484,"06484.mp4","Bruno E Marrone","Agora Vai","Vai Pode Ir Embora Antes..."
6485,"06485.mp4","Edson E Hudson","Azul","Foi Na Manhã Em Que Eu Te Encontrei..."
6486,"06486.mp4","Kelly Key","Cachorrinho","Se Tem Uma Coisa Que Me Deixa Passada..."
6487,"06487.mp4","Claudio Zoli","Cada Um, Cada Um (A Namoradeira)","Foi Bom Te Ver Saber Que Você É Feliz..."
6488,"06488.mp4","Grupo Revelação","Coração Radiante","O Que Mais Quero É Te Dar Um Beijo..."
6489,"06489.mp4","Daniel","Dá-Me, Dá-Me (Dame Dame)","Dá-Me Dá-Me Dá-Me..."
6490,"06490.mp4","Banda Calypso","Dançando Calypso","Chega Pra Cá Meu Bem Que Eu Vou Te..."
6491,"06491.mp4","Raça Negra E Reginaldo Rossi","Deixa De Banca","Parabadá... Deixa De Banca Comigo..."
6492,"06492.mp4","Cpm 22","Desconfio","Sei Como Que As Coisas São..."
6493,"06493.mp4","Sempre Livre","Fui Eu","Os Pés Descalços Queimando O Asfalto..."
6494,"06494.mp4","Jorge Vercilo","Homem-Aranha","Eu Adoro Andar No Abismo..."
6495,"06495.mp4","Tribalistas","Já Sei Namorar","Já Sei Namorar..."
6496,"06496.mp4","Altemar Dutra","Maria Helena","Maria Helena És Tu A Minha Inspiração..."
6497,"06497.mp4","Jorge Aragão E Z. Pagodinho","Mutirão De Amor","Cada Um De Nós Deve Saber Se..."
6498,"06498.mp4","Kid Abelha","Nada Sei (Apnéia)","Nada Sei Dessa Vida Vivo Sem Saber..."
6499,"06499.mp4","Rouge","Não Dá Pra Resistir","Eu Não Quero Confessar..."
6500,"06500.mp4","Cezar E Paulinho (Part.Daniel)","Nóis É Caubói (Nóis É Xiki Nu Úrtimo","Nóis É Country É Caubói Nóis É..."
6501,"06501.mp4","Paralamas Do Sucesso","O Calibre","Eu Vivo Sem Saber..."
6502,"06502.mp4","Falamansa","Oh Chuva","Você Que Tem Medo De Chuva..."
6503,"06503.mp4","Agnaldo Timóteo","Os Verdes Campos Da Minha Terra","Se Algum Dia À Minha Terra Eu Voltar..."
6504,"06504.mp4","Martinho Da Vila","Pra Que Dinheiro","Dinheiro Pra Que Dinheiro..."
6505,"06505.mp4","Capital Inicial","Quatro Vezes Você","Rafael Tá Trancado Há Dois Dias No..."
6506,"06506.mp4","Os Travessos","Quer Me Machucar","Nunca Amei Alguém Assim Desse Jeito..."
6507,"06507.mp4","Rouge","Ragatanga (Aserejé)","Olha Lá Quem Vem Virando A Esquina..."
6508,"06508.mp4","Fagner","Revelação","Um Dia Vestido De Saudade Viva..."
6509,"06509.mp4","Jota Quest","Só Hoje","Hoje Eu Preciso Te Encontrar...."
6510,"06510.mp4","Rick E Renner","Só Pensando Em Você","Recordações Não Param..."
6511,"06511.mp4","Elis Regina E Tom Jobim","Só Tinha Que Ser Com Você","É Só Eu Sei Quanto Amor Eu Guardei..."
6512,"06512.mp4","Raul Seixas","Sociedade Alternativa","Viva Viva Viva A Sociedade Alterna..."
6513,"06513.mp4","Moacyr Franco","Suave É A Noite","É Tão Calma A Noite A Noite É De Nós..."
6514,"06514.mp4","Catedral","Tchau","Me Cansei Dos Teus Desenganos..."
6515,"06515.mp4","Leonardo","Te Amo Demais","Eu Sou Assim..."
6516,"06516.mp4","Metrô","Ti Ti Ti","Se Pintar Um Negócio Na Esquina..."
6517,"06517.mp4","Guilherme Arantes","Um Dia, Um Adeus","Só Você..."
6518,"06518.mp4","Wanessa Camargo","Um Dia... Meu Primeiro Amor","Para Começar Um Beijo..."
6519,"06519.mp4","Pique Novo","Uma Estrela","Conversei Com Uma Estrela..."
6520,"06520.mp4","Daniel","Vida Minha","Olha Lá Vem O Sol Vai Chegar Novo Dia..."
6521,"06521.mp4","Alcione","A Loba","Sou Doce Dengosa Polida..."
6522,"06522.mp4","Leonardo","A Malvada","Tanto Mal Tem Me Feito Que Os Meus..."
6523,"06523.mp4","Rita Lee","Agora Só Falta Você","Um Belo Dia Resolvi Mudar..."
6524,"06524.mp4","Maria Creusa","Apelo","Ah... Meu Amor Não Vás Embora..."
6525,"06525.mp4","Elis Regina","Aprendendo A Jogar","Vivendo E Aprendendo A Jogar..."
6526,"06526.mp4","Ivete Sangalo","Astral","Astral Pra Cima Pra Entrar No Clima..."
6527,"06527.mp4","Rouge","Beijo Molhado","Quero Tanto Espero Tanto Seu Beijo..."
6528,"06528.mp4","Zeca Pagodinho","Caviar","Você Sabe O Que É Caviar..."
6529,"06529.mp4","Bruno E Marrone","Credo Em Cruz Ave-Maria","Desce Uma Geladinha..."
6530,"06530.mp4","Paralamas Do Sucesso","Cuide Bem Do Seu Amor","A Vida Sem Freio Me Leva Me Arrasta..."
6531,"06531.mp4","Banda Calypso","Cumbia Do Amor","O Amor Que Sinto Por Você..."
6532,"06532.mp4","Vanessa Jackson","De Volta Pra Mim","Na Nara... Hoje Eu Vi Você E Me Deu..."
6533,"06533.mp4","Caetano Velose E Gilberto Gil","Desde Que O Samba É Samba","A Tristeza É Senhora..."
6534,"06534.mp4","Legião Urbana","Eu Era Um Lobisomem Juvenil","Luz E Sentido E Palavra"
6535,"06535.mp4","Luiza Possi","Eu Sou Assim","Eu Não Sou Como Você Viu..."
6536,"06536.mp4","Jorge Vercilo","Fênix","Eu Prisioneiro Meu..."
6537,"06537.mp4","Titãs","Isso","Isso Que Acontece Com A Gente..."
6538,"06538.mp4","Capital Inicial","Mais","É Sempre Frio É Tão Estranho..."
6539,"06539.mp4","Renato Russo","Mais Uma Vez","Mas É Claro Que O Sol Vai Voltar..."
6540,"06540.mp4","Milton Carlos","Memórias Do Café Nice","Ai Que Saudade Me Dá Ai Que Saudade..."
6541,"06541.mp4","Bruno E Marrone","Menina","Menina Cada Instante Em Minha Vida..."
6542,"06542.mp4","Nélson Gonçalves","Naquela Mesa","Naquela Mesa Ele Sentava Sempre..."
6543,"06543.mp4","Detonautas","Outro Lugar","Ainda Vou Te Levar Pra Outro Lugar..."
6544,"06544.mp4","Beto Guedes","Paisagem Da Janela","Da Janela Lateral Do Quarto De Dormir..."
6545,"06545.mp4","Miúcha E Tom Jobim","Pela Luz Dos Olhos Teus","Quando A Luz Dos Olhos Meus..."
6546,"06546.mp4","Luciana Mello","Prazer E Luz","Luz Quando A Gente Dança É Luz..."
6547,"06547.mp4","Grupo Revelação","Preciso Te Amar","Eu Estou Apaixonado..."
6548,"06548.mp4","Tim Maia","Primavera","Quando O Inverno Chegar..."
6549,"06549.mp4",365,"São Paulo","Tem Dias Que Eu Digo Não...."
6550,"06550.mp4","Cecéu Muniz","Sem Perceber","Me Peguei Juntando As Partes Da Nossa..."
6551,"06551.mp4","Wanessa Camargo","Sem Querer","Pisei Na Bola Meu Deus E Agora..."
6552,"06552.mp4","Klb","Só Dessa Vez","Não Consigo Aceitar Por Que Não Você..."
6553,"06553.mp4","Zezé Di Camargo E Luciano","Sufocado","Pra Que Fingir Que Sofre Eu Sei Que..."
6554,"06554.mp4","Sandy E Júnior","Super Heroi (Não É Fácil)","Não Quero Imitar Deus Ou Coisa Assim..."
6555,"06555.mp4","Zeca Baleiro","Telegrama","Eu Tava Triste Tristinho..."
6556,"06556.mp4","Belchior","Todo Sujo De Batom","Eu Estou Muito Cansado Do Peso Da..."
6557,"06557.mp4","Ls Jack","Uma Carta","Coloquei Uma Carta Numa Velha..."
6558,"06558.mp4","Tribalistas","Velha Infância","Você É Assim Um Sonho Pra Mim..."
6559,"06559.mp4","Os Fevers","Vem Me Ajudar","Perdi Você Porque Não Julguei..."
6560,"06560.mp4","Ara Ketu","Volta","Amor Minha Maior Felicidade..."
6561,"06561.mp4","Angelo Máximo","A Primeira Namorada","A Chuva Já Molhou A Rua..."
6562,"06562.mp4","Kelly Key","Adoleta","Me Ganhou Com Esse Jeito De Menino..."
6563,"06563.mp4","Lenine","Agora É Que São Elas","Belas Singelas Donzelas..."
6564,"06564.mp4","Rouge","Brilha La Luna","Quero Uma Noite Pra Bailar O Zouk..."
6565,"06565.mp4","Babado Novo","Cai Fora","Eu Não Quero Te Prender Diga Onde..."
6566,"06566.mp4","Cpm 22","Dias Atrás","Nunca Mais Espero Te Encontrar..."
6567,"06567.mp4","Fábio Júnior","Em Cada Amanhecer","Quando A Noite Traz O Silêncio..."
6568,"06568.mp4","Chitãozinho E Xororó","Encontro Casual","Boa Noite Um Sorriso Um Encontro..."
6569,"06569.mp4","Jorge Aragão E Jorge Vercilo","Encontro Das Águas","Sem Querer..."
6570,"06570.mp4","Márcia","Eu E A Brisa","Ah... Se A Juventude Que Essa Brisa..."
6571,"06571.mp4","Rick E Renner","Eu Sem Você","Meus Dias Sem Te Ver São Difíceis..."
6572,"06572.mp4","Lulu Santos","Já É","Sei Lá Tem Dias Que A Gente Olha Pra..."
6573,"06573.mp4","Adriana Calcanhoto","Justo Agora","Eu Ouvi Dizer Que Você Assim..."
6574,"06574.mp4","Nélson Gonçalves","Maria Bethânia","Maria Bethânia Tu És Para Mim..."
6575,"06575.mp4","Nara Leão","Meditação","Quem Acreditou..."
6576,"06576.mp4","Só Pra Contrariar","Minha Fantasia","A Minha Fantasia Era Te Ter Um Dia..."
6577,"06577.mp4","Sandy E Júnior","Nada É Por Acaso","Já Faz Algum Tempo Que Eu Fui Te..."
6578,"06578.mp4","Elis Regina","Nada Será Como Antes","Eu Já Estou Com O Pé Nessa Estrada..."
6579,"06579.mp4","João Donato","Não Sei Como Foi","Não Sei Se Foi..."
6580,"06580.mp4","Nana Caymmi","Não Tem Solução","Aconteceu Um Novo Amor Que Não Podia..."
6581,"06581.mp4","Nina Simone","Ne Me Quitte Pas","Ne Me Quitte Pas Il Faut Oublier..."
6582,"06582.mp4","Gal Costa","O Amor Em Paz","Eu Amei E Amei Ai De Mim..."
6583,"06583.mp4","Christian E Ralf","Onde Você For Eu Vou","Quanta Loucura A Gente Faz..."
6584,"06584.mp4","Pedro E Thiago","Pra Onde Você For","De Noite Eu Penso Quem Estará No Meu..."
6585,"06585.mp4","Gustavo Lins","Pra Ser Feliz","Quando A Gente Ficou Nem Tive Tempo..."
6586,"06586.mp4","Zezé Di Camargo E Luciano","Preciso De Um Tempo","Sei Que Sou Assim..."
6587,"06587.mp4","Detonautas","Quando O Sol Se For","Penso No Que Faço..."
6588,"06588.mp4","Dalva De Oliveira","Que Será","Que Será Da Minha Vida..."
6589,"06589.mp4","Rpm","Rainha","Vem Como Uma Chuva De Verão..."
6590,"06590.mp4","Marisa Monte","Rosa","Tu És Divina E Graciosa Estátua..."
6591,"06591.mp4","Paralamas Do Sucesso","Seguindo Estrelas","Sigo Palavras E Busco Estrelas..."
6592,"06592.mp4","Chico Buarque E Bethânia","Sem Fantasia","Vem Meu Menino Vadio Vem Sem Mentir..."
6593,"06593.mp4","Rionegro E Solimões","Temporal De Lágrimas","Quando A Saudade Chega Sofre..."
6594,"06594.mp4","Caetano Veloso E Jorge Mautne","Todo Errado","Eu Não Peço Desculpa E Nem Peço..."
6595,"06595.mp4","Tribalistas","Tribalistas","Os Tribalistas Já Não Querem Ter Razão..."
6596,"06596.mp4","Leonardo","Tua Sombra Em Meu Caminho","Ontem Te Encontrei Na Rua..."
6597,"06597.mp4","Fernanda Porto","Tudo De Bom","Só Poderia Ser Sempre Com Você..."
6598,"06598.mp4","Daniel","Um Homem Apaixonado","Se Você Vive Ao Pé Do Telefone..."
6599,"06599.mp4","Leila Pinheiro","Verde","Quem Pergunta Por Mim..."
6600,"06600.mp4","Lindomar Castilho","Você É Doida Demais","Eu Pensei Em Lhe Entregar..."
6601,"06601.mp4","Ivan Lins","Abre Alas","Abre Alas Pra Minha Folia..."
6602,"06602.mp4","Sérgio Reis","Adeus Mariana","Nasci Lá Na Cidade Me Casei Na Serra..."
6603,"06603.mp4","Jota Quest","Amor Maior","Eu Quero Ficar Só..."
6604,"06604.mp4","Falamansa","Cem Anos","É... Não Foi Por Falta De Me Avisar..."
6605,"06605.mp4","Márcia Ferreira","Chorando Se Foi","Chorando Se Foi..."
6606,"06606.mp4","George Freedman","Coisinha Estúpida","Existe Um Amor Dentro De Mim..."
6607,"06607.mp4","Capital Inicial","Como Devia Estar","Folhas Verdes Caem No Jardim...."
6608,"06608.mp4","Altemar Dutra","Contigo Aprendi","Contigo Aprendi..."
6609,"06609.mp4","Skank","Dois Rios","O Céu Está No Chão..."
6610,"06610.mp4","Gustavo Lins","Escondida","Já Tá Fazendo Um Tempo Eu Tô Num..."
6611,"06611.mp4","Demônios Da Garoa","Iracema","La Laio... Iracema Eu Nunca Mais..."
6612,"06612.mp4","João Bosco","Kid Cavaquinho","Ói Que Foi Só Pegar No Cavaquinho..."
6613,"06613.mp4","Orlando Silva","Lábios Que Beijei","Lábios Que Beijei Mãos Que Eu Afaguei..."
6614,"06614.mp4","Arriba Saia","Libera O Tóim","Sequestraram O Toim Sequestraram..."
6615,"06615.mp4","Bruno E Marrone","Ligação Urbana","Alô Amor Tô Te Ligando De Um Orelhão..."
6616,"06616.mp4","Maysa","Meu Mundo Caiu","Meu Mundo Caiu E Me Fez Ficar Assim..."
6617,"06617.mp4","Edson E Hudson","Mil Razões Para Chorar","Não Sei Por Que Aqui Voltei..."
6618,"06618.mp4","Cauby Peixoto","Molambo","Eu Sei Que Vocês Vão Dizer..."
6619,"06619.mp4","Erasmo Carlos","Mulher (Sexo Frágil)","Dizem Que A Mulher É O Sexo Frágil..."
6620,"06620.mp4","Rionegro E Solimões","Na Sola Da Bota","É Na Sola Da Bota É Na Palma Da Mão..."
6621,"06621.mp4","Léo Jaime","Nada Mudou","Ela Me Dá Um Beijo Na Testa..."
6622,"06622.mp4","Dick Farney","Nem Eu","Não Fazes Favor Nenhum Em Gostar..."
6623,"06623.mp4","Paulinho Da Viola","Nervos De Aço","Você Sabe O Que É Ter Um Amor Meu..."
6624,"06624.mp4","Jair Rodrigues","O Conde","Lá Iá... Encontrei Hoje Cedo..."
6625,"06625.mp4","Amado Batista","O Fruto Do Nosso Amor (Amor Per","Amor Perfeito Existia Entre Nós Dois..."
6626,"06626.mp4","Alcione","O Mundo É De Nós Dois","Esse Nosso Amor É A Perfeição..."
6627,"06627.mp4","Guilherme E Santiago","O Nosso Amor","Nana Nana... O Nosso Amor É Como..."
6628,"06628.mp4","Jorge Benjor","O Telefone Tocou Novamente","O Telefone Tocou Novamente..."
6629,"06629.mp4","Maria Bethânia","Olhos Nos Olhos","Quando Você Me Deixou Meu Bem..."
6630,"06630.mp4","Klb","Por Causa De Você","Só Você Não Vê Finge Que Não Sabe..."
6631,"06631.mp4","Ataulfo Alves","Sei Que É Covardia... Mas","Sei Que É Covardia..."
6632,"06632.mp4","Carlos Gonzaga","Sereno","Sereno Da Madrugada Caindo No Meu..."
6633,"06633.mp4","Genival Lacerda","Severina Xique-Xique","Quem Não Conhece Severina Xique-Xique..."
6634,"06634.mp4","Roupa Nova","Show De Rock'N Roll","Ela Só Se Liga Em Astrologia..."
6635,"06635.mp4","Angela Rô Rô","Só Nos Resta Viver","Dói Em Mim Saber..."
6636,"06636.mp4","Ivete Sangalo","Sorte Grande","A Minha Sorte Grande Foi Você Cair..."
6637,"06637.mp4","Luka","Tô Nem Aí","De Mãos Atadas De Pés Descalços..."
6638,"06638.mp4","Nélson Gonçalves","Último Desejo","Nosso Amor Que Eu Não Esqueço..."
6639,"06639.mp4","Rouge","Um Anjo Veio Me Falar","Tão Difícil Entender O Coração..."
6640,"06640.mp4","Alexandre Pires","Vem Me Amar (Amame)","Vem Aqui Doce Amor..."
6641,"06641.mp4","Maria Rita","A Festa","Já Falei Tantas Vezes Do Verde Nos..."
6642,"06642.mp4","Edson E Hudson","A Força Da Paixão","Deus Fez A Terra E O Mar..."
6643,"06643.mp4","Gilberto Gil","A Gente Precisa Ver O Luar","O Luar..."
6644,"06644.mp4","Só Pra Contrariar","A Rede","Quando Ela Partiu Ela Levou..."
6645,"06645.mp4","Luiza Possi","Além Do Arco-Íris","Além Do Arco-Íris Pode Ser..."
6646,"06646.mp4","Beto Guedes","Amor De Índio","Tudo Que Move É Sagrado..."
6647,"06647.mp4","Rita Lee","Amor E Sexo","Amor É Um Livro Sexo É Esporte..."
6648,"06648.mp4","Leonardo","Brincadeira Tem Hora","Na Na.... Vê Se Fala Sério..."
6649,"06649.mp4","Alexandre Pires","Bum, Bum, Bum","Amiga Olha Só Como Mudou A Vida..."
6650,"06650.mp4","Débora Blando","Chocolate Com Pimenta","Um Frio Queimando E Um Calor De Chove..."
6651,"06651.mp4","Benito De Paula","Do Jeito Que A Vida Quer","Ninguém Sabe A Mágoa Que Trago..."
6652,"06652.mp4","Sandy E Júnior","Encanto","Se Eu Pudesse Libertar..."
6653,"06653.mp4","Daniel","Encanto Da Natureza","Tu Que Não Tiveste A Felicidade..."
6654,"06654.mp4","Titãs","Enquanto Houver Sol","Quando Não Houver Saída..."
6655,"06655.mp4","Chitãozinho E Xororó","Frete","Eu Conheço Cada Palmo Desse Chão..."
6656,"06656.mp4","Ataulfo Alves","Leva Meu Samba","Leva Meu Samba Meu Mensageiro..."
6657,"06657.mp4","Rionegro E Solimões","Madrugada Triste","Onde Anda Você..."
6658,"06658.mp4","Os Fevers","Mar De Rosas","Você Bem Sabe..."
6659,"06659.mp4","Os Incríveis","Marcas Do Que Se Foi","Este Ano Quero Paz No Meu Coração..."
6660,"06660.mp4","Daniela Mercury","Meu Plano","Tchururu.... Meu Plano Era Deixar..."
6661,"06661.mp4","Fábio Júnior","Minha Outra Metade","Sabe Eu Vou Tentar De Novo..."
6662,"06662.mp4","Jorge Vercilo","Monalisa","É Incrível Nada Desvia Um Destino..."
6663,"06663.mp4","Gian E Giovani","Na Batida Do Seu Coração","Na Batida Do Seu Coração..."
6664,"06664.mp4","Nélson Gonçalves","Normalista","Vestida De Azul E Branco..."
6665,"06665.mp4","Christian E Ralf","Nova York","Essa É A História De Um Novo Herói..."
6666,"06666.mp4","Paulo Diniz","O Meu Amor Chorou","O Meu Amor Chorou Não Sei..."
6667,"06667.mp4","Martinho Da Vila","O Pequeno Burguês","Felicidade Passei No Vestibular..."
6668,"06668.mp4","Tribalistas","Passe Em Casa","Passam Pássaros E Aviões E No Chão..."
6669,"06669.mp4","Leci Brandão","Perdoa","Estou Sofrendo Te Querendo..."
6670,"06670.mp4","Luiz Ayrão","Porta Aberta","Pela Porta Aberta De Um Coração..."
6671,"06671.mp4","Zezé Di Camargo E Luciano","Pra Mudar Minha Vida","Queria Tanto Te Dizer Que Eu Já..."
6672,"06672.mp4","Br'Oz","Prometida","Esse Beijo Da Tua Boca..."
6673,"06673.mp4","Fagner","Quem Me Levará Sou Eu","Amigos A Gente Encontra O Mundo Não..."
6674,"06674.mp4","Sidney Magal","Se Te Agarro Com Outro Te Mato","Se Te Agarro Com Outro Te Mato..."
6675,"06675.mp4","Ls Jack","Sem Radar","É Só Me Recompor Mas Eu Não..."
6676,"06676.mp4","Preta Gil","Sinais De Fogo","Quando Você Me Vê..."
